======================================================================
CURRICULUM LEARNING TEST: A-JEPA v2
======================================================================

Device: cpu

Curriculum Schedule:
  Phase 1 (Easy):   30 epochs - 1 ball, no sparsity
  Phase 2 (Medium): 40 epochs - 2 balls, sparsity ramps 0→0.5
  Phase 3 (Hard):   40 epochs - 2-3 balls, full sparsity
  Total: 110 SSL epochs

Creating models (config: default)...
A-JEPA v2 params: 180,752
V-JEPA v2 params: 1,637,632

======================================================================
TRAINING A-JEPA v2 WITH CURRICULUM
======================================================================

============================================================
Phase 1/3: EASY
============================================================
easy phase:   0%|          | 0/30 [00:00<?, ?it/s]easy phase:   0%|          | 0/30 [00:05<?, ?it/s, loss=38.136, var=1.483, sparse=0.00]easy phase:   3%|▎         | 1/30 [00:05<02:38,  5.45s/it, loss=38.136, var=1.483, sparse=0.00]easy phase:   3%|▎         | 1/30 [00:10<02:38,  5.45s/it, loss=10.461, var=0.127, sparse=0.00]easy phase:   7%|▋         | 2/30 [00:10<02:30,  5.37s/it, loss=10.461, var=0.127, sparse=0.00]easy phase:   7%|▋         | 2/30 [00:15<02:30,  5.37s/it, loss=7.320, var=0.107, sparse=0.00] easy phase:  10%|█         | 3/30 [00:15<02:23,  5.30s/it, loss=7.320, var=0.107, sparse=0.00]easy phase:  10%|█         | 3/30 [00:21<02:23,  5.30s/it, loss=6.030, var=0.083, sparse=0.00]easy phase:  13%|█▎        | 4/30 [00:21<02:19,  5.37s/it, loss=6.030, var=0.083, sparse=0.00]easy phase:  13%|█▎        | 4/30 [00:26<02:19,  5.37s/it, loss=4.448, var=0.050, sparse=0.00]easy phase:  17%|█▋        | 5/30 [00:26<02:13,  5.33s/it, loss=4.448, var=0.050, sparse=0.00]easy phase:  17%|█▋        | 5/30 [00:31<02:13,  5.33s/it, loss=5.195, var=0.067, sparse=0.00]easy phase:  20%|██        | 6/30 [00:31<02:07,  5.30s/it, loss=5.195, var=0.067, sparse=0.00]easy phase:  20%|██        | 6/30 [00:37<02:07,  5.30s/it, loss=5.369, var=0.054, sparse=0.00]easy phase:  23%|██▎       | 7/30 [00:37<02:01,  5.28s/it, loss=5.369, var=0.054, sparse=0.00]easy phase:  23%|██▎       | 7/30 [00:42<02:01,  5.28s/it, loss=5.866, var=0.061, sparse=0.00]easy phase:  27%|██▋       | 8/30 [00:42<01:55,  5.26s/it, loss=5.866, var=0.061, sparse=0.00]easy phase:  27%|██▋       | 8/30 [00:47<01:55,  5.26s/it, loss=5.941, var=0.085, sparse=0.00]easy phase:  30%|███       | 9/30 [00:47<01:50,  5.26s/it, loss=5.941, var=0.085, sparse=0.00]easy phase:  30%|███       | 9/30 [00:52<01:50,  5.26s/it, loss=5.637, var=0.076, sparse=0.00]easy phase:  33%|███▎      | 10/30 [00:52<01:45,  5.25s/it, loss=5.637, var=0.076, sparse=0.00]easy phase:  33%|███▎      | 10/30 [00:58<01:45,  5.25s/it, loss=4.950, var=0.051, sparse=0.00]easy phase:  37%|███▋      | 11/30 [00:58<01:39,  5.26s/it, loss=4.950, var=0.051, sparse=0.00]easy phase:  37%|███▋      | 11/30 [01:03<01:39,  5.26s/it, loss=4.776, var=0.056, sparse=0.00]easy phase:  40%|████      | 12/30 [01:03<01:34,  5.26s/it, loss=4.776, var=0.056, sparse=0.00]easy phase:  40%|████      | 12/30 [01:08<01:34,  5.26s/it, loss=4.020, var=0.036, sparse=0.00]easy phase:  43%|████▎     | 13/30 [01:08<01:29,  5.25s/it, loss=4.020, var=0.036, sparse=0.00]easy phase:  43%|████▎     | 13/30 [01:13<01:29,  5.25s/it, loss=4.670, var=0.078, sparse=0.00]easy phase:  47%|████▋     | 14/30 [01:13<01:23,  5.25s/it, loss=4.670, var=0.078, sparse=0.00]easy phase:  47%|████▋     | 14/30 [01:19<01:23,  5.25s/it, loss=5.358, var=0.101, sparse=0.00]easy phase:  50%|█████     | 15/30 [01:19<01:18,  5.25s/it, loss=5.358, var=0.101, sparse=0.00]easy phase:  50%|█████     | 15/30 [01:24<01:18,  5.25s/it, loss=4.469, var=0.066, sparse=0.00]easy phase:  53%|█████▎    | 16/30 [01:24<01:14,  5.31s/it, loss=4.469, var=0.066, sparse=0.00]easy phase:  53%|█████▎    | 16/30 [01:29<01:14,  5.31s/it, loss=5.869, var=0.118, sparse=0.00]easy phase:  57%|█████▋    | 17/30 [01:29<01:08,  5.30s/it, loss=5.869, var=0.118, sparse=0.00]easy phase:  57%|█████▋    | 17/30 [01:35<01:08,  5.30s/it, loss=5.569, var=0.104, sparse=0.00]easy phase:  60%|██████    | 18/30 [01:35<01:03,  5.29s/it, loss=5.569, var=0.104, sparse=0.00]easy phase:  60%|██████    | 18/30 [01:40<01:03,  5.29s/it, loss=4.290, var=0.039, sparse=0.00]easy phase:  63%|██████▎   | 19/30 [01:40<00:57,  5.27s/it, loss=4.290, var=0.039, sparse=0.00]easy phase:  63%|██████▎   | 19/30 [01:45<00:57,  5.27s/it, loss=4.370, var=0.054, sparse=0.00]easy phase:  67%|██████▋   | 20/30 [01:45<00:52,  5.27s/it, loss=4.370, var=0.054, sparse=0.00]easy phase:  67%|██████▋   | 20/30 [01:50<00:52,  5.27s/it, loss=5.017, var=0.085, sparse=0.00]easy phase:  70%|███████   | 21/30 [01:50<00:47,  5.26s/it, loss=5.017, var=0.085, sparse=0.00]easy phase:  70%|███████   | 21/30 [01:56<00:47,  5.26s/it, loss=3.963, var=0.059, sparse=0.00]easy phase:  73%|███████▎  | 22/30 [01:56<00:42,  5.28s/it, loss=3.963, var=0.059, sparse=0.00]easy phase:  73%|███████▎  | 22/30 [02:01<00:42,  5.28s/it, loss=4.950, var=0.096, sparse=0.00]easy phase:  77%|███████▋  | 23/30 [02:01<00:37,  5.31s/it, loss=4.950, var=0.096, sparse=0.00]easy phase:  77%|███████▋  | 23/30 [02:06<00:37,  5.31s/it, loss=4.239, var=0.054, sparse=0.00]easy phase:  80%|████████  | 24/30 [02:06<00:31,  5.29s/it, loss=4.239, var=0.054, sparse=0.00]easy phase:  80%|████████  | 24/30 [02:12<00:31,  5.29s/it, loss=3.750, var=0.047, sparse=0.00]easy phase:  83%|████████▎ | 25/30 [02:12<00:26,  5.28s/it, loss=3.750, var=0.047, sparse=0.00]easy phase:  83%|████████▎ | 25/30 [02:17<00:26,  5.28s/it, loss=5.664, var=0.107, sparse=0.00]easy phase:  87%|████████▋ | 26/30 [02:17<00:21,  5.26s/it, loss=5.664, var=0.107, sparse=0.00]easy phase:  87%|████████▋ | 26/30 [02:22<00:21,  5.26s/it, loss=4.132, var=0.042, sparse=0.00]easy phase:  90%|█████████ | 27/30 [02:22<00:15,  5.25s/it, loss=4.132, var=0.042, sparse=0.00]easy phase:  90%|█████████ | 27/30 [02:27<00:15,  5.25s/it, loss=5.204, var=0.088, sparse=0.00]easy phase:  93%|█████████▎| 28/30 [02:27<00:10,  5.24s/it, loss=5.204, var=0.088, sparse=0.00]easy phase:  93%|█████████▎| 28/30 [02:32<00:10,  5.24s/it, loss=7.547, var=0.096, sparse=0.00]easy phase:  97%|█████████▋| 29/30 [02:32<00:05,  5.23s/it, loss=7.547, var=0.096, sparse=0.00]easy phase:  97%|█████████▋| 29/30 [02:38<00:05,  5.23s/it, loss=6.515, var=0.142, sparse=0.00]easy phase: 100%|██████████| 30/30 [02:38<00:00,  5.23s/it, loss=6.515, var=0.142, sparse=0.00]easy phase: 100%|██████████| 30/30 [02:38<00:00,  5.27s/it, loss=6.515, var=0.142, sparse=0.00]

============================================================
Phase 2/3: MEDIUM
============================================================
medium phase:   0%|          | 0/40 [00:00<?, ?it/s]medium phase:   0%|          | 0/40 [00:05<?, ?it/s, loss=9.455, var=0.131, sparse=0.00]medium phase:   2%|▎         | 1/40 [00:05<03:23,  5.21s/it, loss=9.455, var=0.131, sparse=0.00]medium phase:   2%|▎         | 1/40 [00:10<03:23,  5.21s/it, loss=7.293, var=0.069, sparse=0.01]medium phase:   5%|▌         | 2/40 [00:10<03:18,  5.22s/it, loss=7.293, var=0.069, sparse=0.01]medium phase:   5%|▌         | 2/40 [00:15<03:18,  5.22s/it, loss=6.001, var=0.050, sparse=0.03]medium phase:   8%|▊         | 3/40 [00:15<03:13,  5.22s/it, loss=6.001, var=0.050, sparse=0.03]medium phase:   8%|▊         | 3/40 [00:20<03:13,  5.22s/it, loss=5.167, var=0.042, sparse=0.04]medium phase:  10%|█         | 4/40 [00:20<03:08,  5.25s/it, loss=5.167, var=0.042, sparse=0.04]medium phase:  10%|█         | 4/40 [00:26<03:08,  5.25s/it, loss=5.284, var=0.048, sparse=0.05]medium phase:  12%|█▎        | 5/40 [00:26<03:03,  5.25s/it, loss=5.284, var=0.048, sparse=0.05]medium phase:  12%|█▎        | 5/40 [00:31<03:03,  5.25s/it, loss=4.861, var=0.069, sparse=0.06]medium phase:  15%|█▌        | 6/40 [00:31<02:58,  5.24s/it, loss=4.861, var=0.069, sparse=0.06]medium phase:  15%|█▌        | 6/40 [00:36<02:58,  5.24s/it, loss=4.332, var=0.026, sparse=0.07]medium phase:  18%|█▊        | 7/40 [00:36<02:52,  5.24s/it, loss=4.332, var=0.026, sparse=0.07]medium phase:  18%|█▊        | 7/40 [00:41<02:52,  5.24s/it, loss=4.384, var=0.035, sparse=0.09]medium phase:  20%|██        | 8/40 [00:41<02:47,  5.24s/it, loss=4.384, var=0.035, sparse=0.09]medium phase:  20%|██        | 8/40 [00:47<02:47,  5.24s/it, loss=5.969, var=0.071, sparse=0.10]medium phase:  22%|██▎       | 9/40 [00:47<02:42,  5.24s/it, loss=5.969, var=0.071, sparse=0.10]medium phase:  22%|██▎       | 9/40 [00:52<02:42,  5.24s/it, loss=7.857, var=0.124, sparse=0.11]medium phase:  25%|██▌       | 10/40 [00:52<02:39,  5.32s/it, loss=7.857, var=0.124, sparse=0.11]medium phase:  25%|██▌       | 10/40 [00:57<02:39,  5.32s/it, loss=6.381, var=0.095, sparse=0.12]medium phase:  28%|██▊       | 11/40 [00:57<02:33,  5.30s/it, loss=6.381, var=0.095, sparse=0.12]medium phase:  28%|██▊       | 11/40 [01:03<02:33,  5.30s/it, loss=4.323, var=0.023, sparse=0.14]medium phase:  30%|███       | 12/40 [01:03<02:27,  5.27s/it, loss=4.323, var=0.023, sparse=0.14]medium phase:  30%|███       | 12/40 [01:08<02:27,  5.27s/it, loss=4.059, var=0.021, sparse=0.15]medium phase:  32%|███▎      | 13/40 [01:08<02:21,  5.25s/it, loss=4.059, var=0.021, sparse=0.15]medium phase:  32%|███▎      | 13/40 [01:13<02:21,  5.25s/it, loss=3.907, var=0.033, sparse=0.16]medium phase:  35%|███▌      | 14/40 [01:13<02:16,  5.24s/it, loss=3.907, var=0.033, sparse=0.16]medium phase:  35%|███▌      | 14/40 [01:18<02:16,  5.24s/it, loss=3.927, var=0.034, sparse=0.17]medium phase:  38%|███▊      | 15/40 [01:18<02:11,  5.28s/it, loss=3.927, var=0.034, sparse=0.17]medium phase:  38%|███▊      | 15/40 [01:24<02:11,  5.28s/it, loss=4.138, var=0.029, sparse=0.19]medium phase:  40%|████      | 16/40 [01:24<02:06,  5.27s/it, loss=4.138, var=0.029, sparse=0.19]medium phase:  40%|████      | 16/40 [01:29<02:06,  5.27s/it, loss=4.154, var=0.044, sparse=0.20]medium phase:  42%|████▎     | 17/40 [01:29<02:00,  5.26s/it, loss=4.154, var=0.044, sparse=0.20]medium phase:  42%|████▎     | 17/40 [01:34<02:00,  5.26s/it, loss=3.485, var=0.015, sparse=0.21]medium phase:  45%|████▌     | 18/40 [01:34<01:55,  5.25s/it, loss=3.485, var=0.015, sparse=0.21]medium phase:  45%|████▌     | 18/40 [01:39<01:55,  5.25s/it, loss=4.092, var=0.021, sparse=0.23]medium phase:  48%|████▊     | 19/40 [01:39<01:50,  5.25s/it, loss=4.092, var=0.021, sparse=0.23]medium phase:  48%|████▊     | 19/40 [01:45<01:50,  5.25s/it, loss=3.620, var=0.021, sparse=0.24]medium phase:  50%|█████     | 20/40 [01:45<01:44,  5.24s/it, loss=3.620, var=0.021, sparse=0.24]medium phase:  50%|█████     | 20/40 [01:50<01:44,  5.24s/it, loss=3.656, var=0.022, sparse=0.25]medium phase:  52%|█████▎    | 21/40 [01:50<01:39,  5.23s/it, loss=3.656, var=0.022, sparse=0.25]medium phase:  52%|█████▎    | 21/40 [01:55<01:39,  5.23s/it, loss=3.717, var=0.031, sparse=0.26]medium phase:  55%|█████▌    | 22/40 [01:55<01:34,  5.24s/it, loss=3.717, var=0.031, sparse=0.26]medium phase:  55%|█████▌    | 22/40 [02:00<01:34,  5.24s/it, loss=4.578, var=0.043, sparse=0.28]medium phase:  57%|█████▊    | 23/40 [02:00<01:28,  5.23s/it, loss=4.578, var=0.043, sparse=0.28]medium phase:  57%|█████▊    | 23/40 [02:05<01:28,  5.23s/it, loss=4.795, var=0.050, sparse=0.29]medium phase:  60%|██████    | 24/40 [02:05<01:23,  5.23s/it, loss=4.795, var=0.050, sparse=0.29]medium phase:  60%|██████    | 24/40 [02:11<01:23,  5.23s/it, loss=3.905, var=0.016, sparse=0.30]medium phase:  62%|██████▎   | 25/40 [02:11<01:18,  5.23s/it, loss=3.905, var=0.016, sparse=0.30]medium phase:  62%|██████▎   | 25/40 [02:16<01:18,  5.23s/it, loss=3.773, var=0.020, sparse=0.31]medium phase:  65%|██████▌   | 26/40 [02:16<01:13,  5.22s/it, loss=3.773, var=0.020, sparse=0.31]medium phase:  65%|██████▌   | 26/40 [02:21<01:13,  5.22s/it, loss=5.451, var=0.090, sparse=0.33]medium phase:  68%|██████▊   | 27/40 [02:21<01:08,  5.26s/it, loss=5.451, var=0.090, sparse=0.33]medium phase:  68%|██████▊   | 27/40 [02:26<01:08,  5.26s/it, loss=4.108, var=0.025, sparse=0.34]medium phase:  70%|███████   | 28/40 [02:26<01:02,  5.25s/it, loss=4.108, var=0.025, sparse=0.34]medium phase:  70%|███████   | 28/40 [02:32<01:02,  5.25s/it, loss=3.659, var=0.020, sparse=0.35]medium phase:  72%|███████▎  | 29/40 [02:32<00:57,  5.24s/it, loss=3.659, var=0.020, sparse=0.35]medium phase:  72%|███████▎  | 29/40 [02:37<00:57,  5.24s/it, loss=3.385, var=0.028, sparse=0.36]medium phase:  75%|███████▌  | 30/40 [02:37<00:52,  5.23s/it, loss=3.385, var=0.028, sparse=0.36]medium phase:  75%|███████▌  | 30/40 [02:42<00:52,  5.23s/it, loss=3.616, var=0.023, sparse=0.38]medium phase:  78%|███████▊  | 31/40 [02:42<00:47,  5.23s/it, loss=3.616, var=0.023, sparse=0.38]medium phase:  78%|███████▊  | 31/40 [02:47<00:47,  5.23s/it, loss=3.433, var=0.017, sparse=0.39]medium phase:  80%|████████  | 32/40 [02:47<00:41,  5.23s/it, loss=3.433, var=0.017, sparse=0.39]medium phase:  80%|████████  | 32/40 [02:53<00:41,  5.23s/it, loss=3.348, var=0.029, sparse=0.40]medium phase:  82%|████████▎ | 33/40 [02:53<00:36,  5.23s/it, loss=3.348, var=0.029, sparse=0.40]medium phase:  82%|████████▎ | 33/40 [02:58<00:36,  5.23s/it, loss=3.478, var=0.026, sparse=0.41]medium phase:  85%|████████▌ | 34/40 [02:58<00:31,  5.23s/it, loss=3.478, var=0.026, sparse=0.41]medium phase:  85%|████████▌ | 34/40 [03:03<00:31,  5.23s/it, loss=4.468, var=0.017, sparse=0.42]medium phase:  88%|████████▊ | 35/40 [03:03<00:26,  5.23s/it, loss=4.468, var=0.017, sparse=0.42]medium phase:  88%|████████▊ | 35/40 [03:08<00:26,  5.23s/it, loss=4.059, var=0.040, sparse=0.44]medium phase:  90%|█████████ | 36/40 [03:08<00:20,  5.23s/it, loss=4.059, var=0.040, sparse=0.44]medium phase:  90%|█████████ | 36/40 [03:14<00:20,  5.23s/it, loss=3.827, var=0.018, sparse=0.45]medium phase:  92%|█████████▎| 37/40 [03:14<00:15,  5.23s/it, loss=3.827, var=0.018, sparse=0.45]medium phase:  92%|█████████▎| 37/40 [03:19<00:15,  5.23s/it, loss=3.703, var=0.020, sparse=0.46]medium phase:  95%|█████████▌| 38/40 [03:19<00:10,  5.25s/it, loss=3.703, var=0.020, sparse=0.46]medium phase:  95%|█████████▌| 38/40 [03:24<00:10,  5.25s/it, loss=3.636, var=0.028, sparse=0.47]medium phase:  98%|█████████▊| 39/40 [03:24<00:05,  5.24s/it, loss=3.636, var=0.028, sparse=0.47]medium phase:  98%|█████████▊| 39/40 [03:29<00:05,  5.24s/it, loss=3.424, var=0.028, sparse=0.49]medium phase: 100%|██████████| 40/40 [03:29<00:00,  5.24s/it, loss=3.424, var=0.028, sparse=0.49]medium phase: 100%|██████████| 40/40 [03:29<00:00,  5.24s/it, loss=3.424, var=0.028, sparse=0.49]

============================================================
Phase 3/3: HARD
============================================================
hard phase:   0%|          | 0/40 [00:00<?, ?it/s]hard phase:   0%|          | 0/40 [00:05<?, ?it/s, loss=5.925, var=0.047, sparse=1.00]hard phase:   2%|▎         | 1/40 [00:05<03:23,  5.22s/it, loss=5.925, var=0.047, sparse=1.00]hard phase:   2%|▎         | 1/40 [00:10<03:23,  5.22s/it, loss=4.468, var=0.033, sparse=1.00]hard phase:   5%|▌         | 2/40 [00:10<03:18,  5.23s/it, loss=4.468, var=0.033, sparse=1.00]hard phase:   5%|▌         | 2/40 [00:15<03:18,  5.23s/it, loss=4.471, var=0.031, sparse=1.00]hard phase:   8%|▊         | 3/40 [00:15<03:13,  5.23s/it, loss=4.471, var=0.031, sparse=1.00]hard phase:   8%|▊         | 3/40 [00:20<03:13,  5.23s/it, loss=4.481, var=0.052, sparse=1.00]hard phase:  10%|█         | 4/40 [00:20<03:08,  5.23s/it, loss=4.481, var=0.052, sparse=1.00]hard phase:  10%|█         | 4/40 [00:26<03:08,  5.23s/it, loss=6.281, var=0.092, sparse=1.00]hard phase:  12%|█▎        | 5/40 [00:26<03:06,  5.33s/it, loss=6.281, var=0.092, sparse=1.00]hard phase:  12%|█▎        | 5/40 [00:31<03:06,  5.33s/it, loss=4.833, var=0.034, sparse=1.00]hard phase:  15%|█▌        | 6/40 [00:31<03:01,  5.33s/it, loss=4.833, var=0.034, sparse=1.00]hard phase:  15%|█▌        | 6/40 [00:36<03:01,  5.33s/it, loss=4.368, var=0.026, sparse=1.00]hard phase:  18%|█▊        | 7/40 [00:36<02:54,  5.30s/it, loss=4.368, var=0.026, sparse=1.00]hard phase:  18%|█▊        | 7/40 [00:42<02:54,  5.30s/it, loss=4.750, var=0.057, sparse=1.00]hard phase:  20%|██        | 8/40 [00:42<02:48,  5.27s/it, loss=4.750, var=0.057, sparse=1.00]hard phase:  20%|██        | 8/40 [00:47<02:48,  5.27s/it, loss=4.107, var=0.025, sparse=1.00]hard phase:  22%|██▎       | 9/40 [00:47<02:43,  5.27s/it, loss=4.107, var=0.025, sparse=1.00]hard phase:  22%|██▎       | 9/40 [00:52<02:43,  5.27s/it, loss=4.096, var=0.029, sparse=1.00]hard phase:  25%|██▌       | 10/40 [00:52<02:37,  5.27s/it, loss=4.096, var=0.029, sparse=1.00]hard phase:  25%|██▌       | 10/40 [00:58<02:37,  5.27s/it, loss=3.755, var=0.027, sparse=1.00]hard phase:  28%|██▊       | 11/40 [00:58<02:33,  5.30s/it, loss=3.755, var=0.027, sparse=1.00]hard phase:  28%|██▊       | 11/40 [01:03<02:33,  5.30s/it, loss=3.634, var=0.015, sparse=1.00]hard phase:  30%|███       | 12/40 [01:03<02:27,  5.26s/it, loss=3.634, var=0.015, sparse=1.00]hard phase:  30%|███       | 12/40 [01:08<02:27,  5.26s/it, loss=4.204, var=0.051, sparse=1.00]hard phase:  32%|███▎      | 13/40 [01:08<02:22,  5.27s/it, loss=4.204, var=0.051, sparse=1.00]hard phase:  32%|███▎      | 13/40 [01:13<02:22,  5.27s/it, loss=4.970, var=0.036, sparse=1.00]hard phase:  35%|███▌      | 14/40 [01:13<02:16,  5.25s/it, loss=4.970, var=0.036, sparse=1.00]hard phase:  35%|███▌      | 14/40 [01:18<02:16,  5.25s/it, loss=3.602, var=0.016, sparse=1.00]hard phase:  38%|███▊      | 15/40 [01:18<02:10,  5.23s/it, loss=3.602, var=0.016, sparse=1.00]hard phase:  38%|███▊      | 15/40 [01:24<02:10,  5.23s/it, loss=4.066, var=0.046, sparse=1.00]hard phase:  40%|████      | 16/40 [01:24<02:05,  5.21s/it, loss=4.066, var=0.046, sparse=1.00]hard phase:  40%|████      | 16/40 [01:29<02:05,  5.21s/it, loss=3.710, var=0.030, sparse=1.00]hard phase:  42%|████▎     | 17/40 [01:29<01:59,  5.20s/it, loss=3.710, var=0.030, sparse=1.00]hard phase:  42%|████▎     | 17/40 [01:34<01:59,  5.20s/it, loss=4.164, var=0.039, sparse=1.00]hard phase:  45%|████▌     | 18/40 [01:34<01:54,  5.20s/it, loss=4.164, var=0.039, sparse=1.00]hard phase:  45%|████▌     | 18/40 [01:39<01:54,  5.20s/it, loss=5.324, var=0.085, sparse=1.00]hard phase:  48%|████▊     | 19/40 [01:39<01:49,  5.20s/it, loss=5.324, var=0.085, sparse=1.00]hard phase:  48%|████▊     | 19/40 [01:44<01:49,  5.20s/it, loss=4.293, var=0.029, sparse=1.00]hard phase:  50%|█████     | 20/40 [01:44<01:43,  5.19s/it, loss=4.293, var=0.029, sparse=1.00]hard phase:  50%|█████     | 20/40 [01:50<01:43,  5.19s/it, loss=3.255, var=0.010, sparse=1.00]hard phase:  52%|█████▎    | 21/40 [01:50<01:38,  5.19s/it, loss=3.255, var=0.010, sparse=1.00]hard phase:  52%|█████▎    | 21/40 [01:55<01:38,  5.19s/it, loss=3.365, var=0.015, sparse=1.00]hard phase:  55%|█████▌    | 22/40 [01:55<01:33,  5.19s/it, loss=3.365, var=0.015, sparse=1.00]hard phase:  55%|█████▌    | 22/40 [02:00<01:33,  5.19s/it, loss=3.533, var=0.019, sparse=1.00]hard phase:  57%|█████▊    | 23/40 [02:00<01:28,  5.19s/it, loss=3.533, var=0.019, sparse=1.00]hard phase:  57%|█████▊    | 23/40 [02:05<01:28,  5.19s/it, loss=4.075, var=0.037, sparse=1.00]hard phase:  60%|██████    | 24/40 [02:05<01:22,  5.18s/it, loss=4.075, var=0.037, sparse=1.00]hard phase:  60%|██████    | 24/40 [02:10<01:22,  5.18s/it, loss=3.812, var=0.012, sparse=1.00]hard phase:  62%|██████▎   | 25/40 [02:10<01:17,  5.18s/it, loss=3.812, var=0.012, sparse=1.00]hard phase:  62%|██████▎   | 25/40 [02:15<01:17,  5.18s/it, loss=3.830, var=0.032, sparse=1.00]hard phase:  65%|██████▌   | 26/40 [02:15<01:12,  5.19s/it, loss=3.830, var=0.032, sparse=1.00]hard phase:  65%|██████▌   | 26/40 [02:21<01:12,  5.19s/it, loss=3.877, var=0.036, sparse=1.00]hard phase:  68%|██████▊   | 27/40 [02:21<01:07,  5.19s/it, loss=3.877, var=0.036, sparse=1.00]hard phase:  68%|██████▊   | 27/40 [02:26<01:07,  5.19s/it, loss=3.630, var=0.022, sparse=1.00]hard phase:  70%|███████   | 28/40 [02:26<01:02,  5.18s/it, loss=3.630, var=0.022, sparse=1.00]hard phase:  70%|███████   | 28/40 [02:31<01:02,  5.18s/it, loss=3.797, var=0.037, sparse=1.00]hard phase:  72%|███████▎  | 29/40 [02:31<00:57,  5.18s/it, loss=3.797, var=0.037, sparse=1.00]hard phase:  72%|███████▎  | 29/40 [02:36<00:57,  5.18s/it, loss=3.310, var=0.012, sparse=1.00]hard phase:  75%|███████▌  | 30/40 [02:36<00:51,  5.18s/it, loss=3.310, var=0.012, sparse=1.00]hard phase:  75%|███████▌  | 30/40 [02:41<00:51,  5.18s/it, loss=3.255, var=0.017, sparse=1.00]hard phase:  78%|███████▊  | 31/40 [02:41<00:46,  5.18s/it, loss=3.255, var=0.017, sparse=1.00]hard phase:  78%|███████▊  | 31/40 [02:47<00:46,  5.18s/it, loss=3.295, var=0.026, sparse=1.00]hard phase:  80%|████████  | 32/40 [02:47<00:41,  5.20s/it, loss=3.295, var=0.026, sparse=1.00]hard phase:  80%|████████  | 32/40 [02:52<00:41,  5.20s/it, loss=3.968, var=0.042, sparse=1.00]hard phase:  82%|████████▎ | 33/40 [02:52<00:36,  5.22s/it, loss=3.968, var=0.042, sparse=1.00]hard phase:  82%|████████▎ | 33/40 [02:57<00:36,  5.22s/it, loss=3.647, var=0.020, sparse=1.00]hard phase:  85%|████████▌ | 34/40 [02:57<00:31,  5.21s/it, loss=3.647, var=0.020, sparse=1.00]hard phase:  85%|████████▌ | 34/40 [03:02<00:31,  5.21s/it, loss=3.549, var=0.024, sparse=1.00]hard phase:  88%|████████▊ | 35/40 [03:02<00:25,  5.19s/it, loss=3.549, var=0.024, sparse=1.00]hard phase:  88%|████████▊ | 35/40 [03:07<00:25,  5.19s/it, loss=4.346, var=0.062, sparse=1.00]hard phase:  90%|█████████ | 36/40 [03:07<00:20,  5.19s/it, loss=4.346, var=0.062, sparse=1.00]hard phase:  90%|█████████ | 36/40 [03:13<00:20,  5.19s/it, loss=4.703, var=0.050, sparse=1.00]hard phase:  92%|█████████▎| 37/40 [03:13<00:15,  5.19s/it, loss=4.703, var=0.050, sparse=1.00]hard phase:  92%|█████████▎| 37/40 [03:18<00:15,  5.19s/it, loss=7.001, var=0.101, sparse=1.00]hard phase:  95%|█████████▌| 38/40 [03:18<00:10,  5.18s/it, loss=7.001, var=0.101, sparse=1.00]hard phase:  95%|█████████▌| 38/40 [03:23<00:10,  5.18s/it, loss=4.342, var=0.020, sparse=1.00]hard phase:  98%|█████████▊| 39/40 [03:23<00:05,  5.18s/it, loss=4.342, var=0.020, sparse=1.00]hard phase:  98%|█████████▊| 39/40 [03:28<00:05,  5.18s/it, loss=3.999, var=0.020, sparse=1.00]hard phase: 100%|██████████| 40/40 [03:28<00:00,  5.18s/it, loss=3.999, var=0.020, sparse=1.00]hard phase: 100%|██████████| 40/40 [03:28<00:00,  5.21s/it, loss=3.999, var=0.020, sparse=1.00]

======================================================================
TRAINING A-JEPA v2 BASELINE (NO CURRICULUM)
======================================================================

============================================================
Phase 1/1: HARD
============================================================
hard phase:   0%|          | 0/110 [00:00<?, ?it/s]hard phase:   0%|          | 0/110 [00:05<?, ?it/s, loss=34.599, var=1.320, sparse=1.00]hard phase:   1%|          | 1/110 [00:05<09:24,  5.18s/it, loss=34.599, var=1.320, sparse=1.00]hard phase:   1%|          | 1/110 [00:10<09:24,  5.18s/it, loss=12.477, var=0.175, sparse=1.00]hard phase:   2%|▏         | 2/110 [00:10<09:19,  5.18s/it, loss=12.477, var=0.175, sparse=1.00]hard phase:   2%|▏         | 2/110 [00:15<09:19,  5.18s/it, loss=6.174, var=0.051, sparse=1.00] hard phase:   3%|▎         | 3/110 [00:15<09:13,  5.17s/it, loss=6.174, var=0.051, sparse=1.00]hard phase:   3%|▎         | 3/110 [00:20<09:13,  5.17s/it, loss=6.089, var=0.061, sparse=1.00]hard phase:   4%|▎         | 4/110 [00:20<09:11,  5.20s/it, loss=6.089, var=0.061, sparse=1.00]hard phase:   4%|▎         | 4/110 [00:25<09:11,  5.20s/it, loss=6.327, var=0.039, sparse=1.00]hard phase:   5%|▍         | 5/110 [00:25<09:04,  5.19s/it, loss=6.327, var=0.039, sparse=1.00]hard phase:   5%|▍         | 5/110 [00:31<09:04,  5.19s/it, loss=4.786, var=0.031, sparse=1.00]hard phase:   5%|▌         | 6/110 [00:31<08:59,  5.19s/it, loss=4.786, var=0.031, sparse=1.00]hard phase:   5%|▌         | 6/110 [00:36<08:59,  5.19s/it, loss=5.180, var=0.039, sparse=1.00]hard phase:   6%|▋         | 7/110 [00:36<08:53,  5.18s/it, loss=5.180, var=0.039, sparse=1.00]hard phase:   6%|▋         | 7/110 [00:41<08:53,  5.18s/it, loss=4.846, var=0.026, sparse=1.00]hard phase:   7%|▋         | 8/110 [00:41<08:49,  5.19s/it, loss=4.846, var=0.026, sparse=1.00]hard phase:   7%|▋         | 8/110 [00:46<08:49,  5.19s/it, loss=5.782, var=0.064, sparse=1.00]hard phase:   8%|▊         | 9/110 [00:46<08:43,  5.18s/it, loss=5.782, var=0.064, sparse=1.00]hard phase:   8%|▊         | 9/110 [00:51<08:43,  5.18s/it, loss=5.441, var=0.082, sparse=1.00]hard phase:   9%|▉         | 10/110 [00:51<08:37,  5.18s/it, loss=5.441, var=0.082, sparse=1.00]hard phase:   9%|▉         | 10/110 [00:56<08:37,  5.18s/it, loss=4.852, var=0.033, sparse=1.00]hard phase:  10%|█         | 11/110 [00:56<08:32,  5.18s/it, loss=4.852, var=0.033, sparse=1.00]hard phase:  10%|█         | 11/110 [01:02<08:32,  5.18s/it, loss=5.229, var=0.045, sparse=1.00]hard phase:  11%|█         | 12/110 [01:02<08:27,  5.18s/it, loss=5.229, var=0.045, sparse=1.00]hard phase:  11%|█         | 12/110 [01:07<08:27,  5.18s/it, loss=4.947, var=0.039, sparse=1.00]hard phase:  12%|█▏        | 13/110 [01:07<08:21,  5.17s/it, loss=4.947, var=0.039, sparse=1.00]hard phase:  12%|█▏        | 13/110 [01:12<08:21,  5.17s/it, loss=4.212, var=0.026, sparse=1.00]hard phase:  13%|█▎        | 14/110 [01:12<08:17,  5.18s/it, loss=4.212, var=0.026, sparse=1.00]hard phase:  13%|█▎        | 14/110 [01:17<08:17,  5.18s/it, loss=4.369, var=0.038, sparse=1.00]hard phase:  14%|█▎        | 15/110 [01:17<08:14,  5.21s/it, loss=4.369, var=0.038, sparse=1.00]hard phase:  14%|█▎        | 15/110 [01:22<08:14,  5.21s/it, loss=4.562, var=0.037, sparse=1.00]hard phase:  15%|█▍        | 16/110 [01:22<08:08,  5.20s/it, loss=4.562, var=0.037, sparse=1.00]hard phase:  15%|█▍        | 16/110 [01:28<08:08,  5.20s/it, loss=4.813, var=0.036, sparse=1.00]hard phase:  15%|█▌        | 17/110 [01:28<08:03,  5.20s/it, loss=4.813, var=0.036, sparse=1.00]hard phase:  15%|█▌        | 17/110 [01:33<08:03,  5.20s/it, loss=5.828, var=0.079, sparse=1.00]hard phase:  16%|█▋        | 18/110 [01:33<07:58,  5.20s/it, loss=5.828, var=0.079, sparse=1.00]hard phase:  16%|█▋        | 18/110 [01:38<07:58,  5.20s/it, loss=5.869, var=0.078, sparse=1.00]hard phase:  17%|█▋        | 19/110 [01:38<07:52,  5.19s/it, loss=5.869, var=0.078, sparse=1.00]hard phase:  17%|█▋        | 19/110 [01:43<07:52,  5.19s/it, loss=10.621, var=0.143, sparse=1.00]hard phase:  18%|█▊        | 20/110 [01:43<07:46,  5.19s/it, loss=10.621, var=0.143, sparse=1.00]hard phase:  18%|█▊        | 20/110 [01:48<07:46,  5.19s/it, loss=6.095, var=0.058, sparse=1.00] hard phase:  19%|█▉        | 21/110 [01:48<07:41,  5.18s/it, loss=6.095, var=0.058, sparse=1.00]hard phase:  19%|█▉        | 21/110 [01:54<07:41,  5.18s/it, loss=4.952, var=0.033, sparse=1.00]hard phase:  20%|██        | 22/110 [01:54<07:36,  5.18s/it, loss=4.952, var=0.033, sparse=1.00]hard phase:  20%|██        | 22/110 [01:59<07:36,  5.18s/it, loss=4.670, var=0.039, sparse=1.00]hard phase:  21%|██        | 23/110 [01:59<07:30,  5.18s/it, loss=4.670, var=0.039, sparse=1.00]hard phase:  21%|██        | 23/110 [02:04<07:30,  5.18s/it, loss=5.102, var=0.075, sparse=1.00]hard phase:  22%|██▏       | 24/110 [02:04<07:30,  5.23s/it, loss=5.102, var=0.075, sparse=1.00]hard phase:  22%|██▏       | 24/110 [02:09<07:30,  5.23s/it, loss=3.621, var=0.022, sparse=1.00]hard phase:  23%|██▎       | 25/110 [02:09<07:28,  5.27s/it, loss=3.621, var=0.022, sparse=1.00]hard phase:  23%|██▎       | 25/110 [02:15<07:28,  5.27s/it, loss=3.698, var=0.015, sparse=1.00]hard phase:  24%|██▎       | 26/110 [02:15<07:20,  5.24s/it, loss=3.698, var=0.015, sparse=1.00]hard phase:  24%|██▎       | 26/110 [02:20<07:20,  5.24s/it, loss=3.851, var=0.030, sparse=1.00]hard phase:  25%|██▍       | 27/110 [02:20<07:14,  5.23s/it, loss=3.851, var=0.030, sparse=1.00]hard phase:  25%|██▍       | 27/110 [02:25<07:14,  5.23s/it, loss=3.700, var=0.016, sparse=1.00]hard phase:  25%|██▌       | 28/110 [02:25<07:08,  5.22s/it, loss=3.700, var=0.016, sparse=1.00]hard phase:  25%|██▌       | 28/110 [02:30<07:08,  5.22s/it, loss=3.686, var=0.025, sparse=1.00]hard phase:  26%|██▋       | 29/110 [02:30<07:02,  5.22s/it, loss=3.686, var=0.025, sparse=1.00]hard phase:  26%|██▋       | 29/110 [02:35<07:02,  5.22s/it, loss=3.475, var=0.024, sparse=1.00]hard phase:  27%|██▋       | 30/110 [02:35<06:56,  5.20s/it, loss=3.475, var=0.024, sparse=1.00]hard phase:  27%|██▋       | 30/110 [02:41<06:56,  5.20s/it, loss=3.588, var=0.018, sparse=1.00]hard phase:  28%|██▊       | 31/110 [02:41<06:52,  5.22s/it, loss=3.588, var=0.018, sparse=1.00]hard phase:  28%|██▊       | 31/110 [02:46<06:52,  5.22s/it, loss=3.319, var=0.019, sparse=1.00]hard phase:  29%|██▉       | 32/110 [02:46<06:46,  5.21s/it, loss=3.319, var=0.019, sparse=1.00]hard phase:  29%|██▉       | 32/110 [02:51<06:46,  5.21s/it, loss=3.235, var=0.013, sparse=1.00]hard phase:  30%|███       | 33/110 [02:51<06:40,  5.20s/it, loss=3.235, var=0.013, sparse=1.00]hard phase:  30%|███       | 33/110 [02:56<06:40,  5.20s/it, loss=3.621, var=0.018, sparse=1.00]hard phase:  31%|███       | 34/110 [02:56<06:34,  5.19s/it, loss=3.621, var=0.018, sparse=1.00]hard phase:  31%|███       | 34/110 [03:01<06:34,  5.19s/it, loss=3.466, var=0.016, sparse=1.00]hard phase:  32%|███▏      | 35/110 [03:01<06:28,  5.19s/it, loss=3.466, var=0.016, sparse=1.00]hard phase:  32%|███▏      | 35/110 [03:07<06:28,  5.19s/it, loss=3.594, var=0.020, sparse=1.00]hard phase:  33%|███▎      | 36/110 [03:07<06:23,  5.18s/it, loss=3.594, var=0.020, sparse=1.00]hard phase:  33%|███▎      | 36/110 [03:12<06:23,  5.18s/it, loss=3.816, var=0.017, sparse=1.00]hard phase:  34%|███▎      | 37/110 [03:12<06:18,  5.18s/it, loss=3.816, var=0.017, sparse=1.00]hard phase:  34%|███▎      | 37/110 [03:17<06:18,  5.18s/it, loss=3.426, var=0.019, sparse=1.00]hard phase:  35%|███▍      | 38/110 [03:17<06:14,  5.21s/it, loss=3.426, var=0.019, sparse=1.00]hard phase:  35%|███▍      | 38/110 [03:22<06:14,  5.21s/it, loss=3.847, var=0.024, sparse=1.00]hard phase:  35%|███▌      | 39/110 [03:22<06:09,  5.21s/it, loss=3.847, var=0.024, sparse=1.00]hard phase:  35%|███▌      | 39/110 [03:27<06:09,  5.21s/it, loss=3.963, var=0.037, sparse=1.00]hard phase:  36%|███▋      | 40/110 [03:27<06:03,  5.20s/it, loss=3.963, var=0.037, sparse=1.00]hard phase:  36%|███▋      | 40/110 [03:33<06:03,  5.20s/it, loss=6.408, var=0.064, sparse=1.00]hard phase:  37%|███▋      | 41/110 [03:33<05:58,  5.19s/it, loss=6.408, var=0.064, sparse=1.00]hard phase:  37%|███▋      | 41/110 [03:38<05:58,  5.19s/it, loss=6.800, var=0.076, sparse=1.00]hard phase:  38%|███▊      | 42/110 [03:38<05:53,  5.20s/it, loss=6.800, var=0.076, sparse=1.00]hard phase:  38%|███▊      | 42/110 [03:43<05:53,  5.20s/it, loss=4.559, var=0.017, sparse=1.00]hard phase:  39%|███▉      | 43/110 [03:43<05:47,  5.19s/it, loss=4.559, var=0.017, sparse=1.00]hard phase:  39%|███▉      | 43/110 [03:48<05:47,  5.19s/it, loss=4.177, var=0.031, sparse=1.00]hard phase:  40%|████      | 44/110 [03:48<05:42,  5.18s/it, loss=4.177, var=0.031, sparse=1.00]hard phase:  40%|████      | 44/110 [03:53<05:42,  5.18s/it, loss=3.892, var=0.028, sparse=1.00]hard phase:  41%|████      | 45/110 [03:53<05:36,  5.18s/it, loss=3.892, var=0.028, sparse=1.00]hard phase:  41%|████      | 45/110 [03:58<05:36,  5.18s/it, loss=3.983, var=0.034, sparse=1.00]hard phase:  42%|████▏     | 46/110 [03:58<05:31,  5.18s/it, loss=3.983, var=0.034, sparse=1.00]hard phase:  42%|████▏     | 46/110 [04:04<05:31,  5.18s/it, loss=3.989, var=0.027, sparse=1.00]hard phase:  43%|████▎     | 47/110 [04:04<05:26,  5.18s/it, loss=3.989, var=0.027, sparse=1.00]hard phase:  43%|████▎     | 47/110 [04:09<05:26,  5.18s/it, loss=3.968, var=0.029, sparse=1.00]hard phase:  44%|████▎     | 48/110 [04:09<05:21,  5.19s/it, loss=3.968, var=0.029, sparse=1.00]hard phase:  44%|████▎     | 48/110 [04:14<05:21,  5.19s/it, loss=4.115, var=0.022, sparse=1.00]hard phase:  45%|████▍     | 49/110 [04:14<05:16,  5.18s/it, loss=4.115, var=0.022, sparse=1.00]hard phase:  45%|████▍     | 49/110 [04:19<05:16,  5.18s/it, loss=4.258, var=0.048, sparse=1.00]hard phase:  45%|████▌     | 50/110 [04:19<05:13,  5.23s/it, loss=4.258, var=0.048, sparse=1.00]hard phase:  45%|████▌     | 50/110 [04:25<05:13,  5.23s/it, loss=4.436, var=0.035, sparse=1.00]hard phase:  46%|████▋     | 51/110 [04:25<05:07,  5.21s/it, loss=4.436, var=0.035, sparse=1.00]hard phase:  46%|████▋     | 51/110 [04:30<05:07,  5.21s/it, loss=3.974, var=0.035, sparse=1.00]hard phase:  47%|████▋     | 52/110 [04:30<05:02,  5.21s/it, loss=3.974, var=0.035, sparse=1.00]hard phase:  47%|████▋     | 52/110 [04:35<05:02,  5.21s/it, loss=3.627, var=0.019, sparse=1.00]hard phase:  48%|████▊     | 53/110 [04:35<04:56,  5.20s/it, loss=3.627, var=0.019, sparse=1.00]hard phase:  48%|████▊     | 53/110 [04:40<04:56,  5.20s/it, loss=3.233, var=0.014, sparse=1.00]hard phase:  49%|████▉     | 54/110 [04:40<04:51,  5.20s/it, loss=3.233, var=0.014, sparse=1.00]hard phase:  49%|████▉     | 54/110 [04:45<04:51,  5.20s/it, loss=3.538, var=0.030, sparse=1.00]hard phase:  50%|█████     | 55/110 [04:45<04:45,  5.19s/it, loss=3.538, var=0.030, sparse=1.00]hard phase:  50%|█████     | 55/110 [04:50<04:45,  5.19s/it, loss=3.277, var=0.011, sparse=1.00]hard phase:  51%|█████     | 56/110 [04:50<04:40,  5.19s/it, loss=3.277, var=0.011, sparse=1.00]hard phase:  51%|█████     | 56/110 [04:56<04:40,  5.19s/it, loss=3.286, var=0.018, sparse=1.00]hard phase:  52%|█████▏    | 57/110 [04:56<04:34,  5.18s/it, loss=3.286, var=0.018, sparse=1.00]hard phase:  52%|█████▏    | 57/110 [05:01<04:34,  5.18s/it, loss=3.325, var=0.018, sparse=1.00]hard phase:  53%|█████▎    | 58/110 [05:01<04:29,  5.18s/it, loss=3.325, var=0.018, sparse=1.00]hard phase:  53%|█████▎    | 58/110 [05:06<04:29,  5.18s/it, loss=3.221, var=0.021, sparse=1.00]hard phase:  54%|█████▎    | 59/110 [05:06<04:24,  5.18s/it, loss=3.221, var=0.021, sparse=1.00]hard phase:  54%|█████▎    | 59/110 [05:11<04:24,  5.18s/it, loss=3.309, var=0.022, sparse=1.00]hard phase:  55%|█████▍    | 60/110 [05:11<04:17,  5.16s/it, loss=3.309, var=0.022, sparse=1.00]hard phase:  55%|█████▍    | 60/110 [05:16<04:17,  5.16s/it, loss=3.680, var=0.023, sparse=1.00]hard phase:  55%|█████▌    | 61/110 [05:16<04:12,  5.15s/it, loss=3.680, var=0.023, sparse=1.00]hard phase:  55%|█████▌    | 61/110 [05:22<04:12,  5.15s/it, loss=4.484, var=0.046, sparse=1.00]hard phase:  56%|█████▋    | 62/110 [05:22<04:09,  5.19s/it, loss=4.484, var=0.046, sparse=1.00]hard phase:  56%|█████▋    | 62/110 [05:27<04:09,  5.19s/it, loss=4.010, var=0.020, sparse=1.00]hard phase:  57%|█████▋    | 63/110 [05:27<04:03,  5.19s/it, loss=4.010, var=0.020, sparse=1.00]hard phase:  57%|█████▋    | 63/110 [05:32<04:03,  5.19s/it, loss=3.443, var=0.020, sparse=1.00]hard phase:  58%|█████▊    | 64/110 [05:32<03:58,  5.19s/it, loss=3.443, var=0.020, sparse=1.00]hard phase:  58%|█████▊    | 64/110 [05:37<03:58,  5.19s/it, loss=3.990, var=0.032, sparse=1.00]hard phase:  59%|█████▉    | 65/110 [05:37<03:53,  5.19s/it, loss=3.990, var=0.032, sparse=1.00]hard phase:  59%|█████▉    | 65/110 [05:42<03:53,  5.19s/it, loss=3.609, var=0.033, sparse=1.00]hard phase:  60%|██████    | 66/110 [05:42<03:48,  5.19s/it, loss=3.609, var=0.033, sparse=1.00]hard phase:  60%|██████    | 66/110 [05:47<03:48,  5.19s/it, loss=3.399, var=0.018, sparse=1.00]hard phase:  61%|██████    | 67/110 [05:47<03:32,  4.95s/it, loss=3.399, var=0.018, sparse=1.00]hard phase:  61%|██████    | 67/110 [05:50<03:32,  4.95s/it, loss=3.350, var=0.022, sparse=1.00]hard phase:  62%|██████▏   | 68/110 [05:50<03:09,  4.51s/it, loss=3.350, var=0.022, sparse=1.00]hard phase:  62%|██████▏   | 68/110 [05:54<03:09,  4.51s/it, loss=5.371, var=0.075, sparse=1.00]hard phase:  63%|██████▎   | 69/110 [05:54<02:52,  4.20s/it, loss=5.371, var=0.075, sparse=1.00]hard phase:  63%|██████▎   | 69/110 [05:57<02:52,  4.20s/it, loss=3.787, var=0.028, sparse=1.00]hard phase:  64%|██████▎   | 70/110 [05:57<02:39,  3.98s/it, loss=3.787, var=0.028, sparse=1.00]hard phase:  64%|██████▎   | 70/110 [06:01<02:39,  3.98s/it, loss=3.666, var=0.027, sparse=1.00]hard phase:  65%|██████▍   | 71/110 [06:01<02:29,  3.83s/it, loss=3.666, var=0.027, sparse=1.00]hard phase:  65%|██████▍   | 71/110 [06:04<02:29,  3.83s/it, loss=3.636, var=0.025, sparse=1.00]hard phase:  65%|██████▌   | 72/110 [06:04<02:21,  3.73s/it, loss=3.636, var=0.025, sparse=1.00]hard phase:  65%|██████▌   | 72/110 [06:08<02:21,  3.73s/it, loss=3.923, var=0.025, sparse=1.00]hard phase:  66%|██████▋   | 73/110 [06:08<02:15,  3.65s/it, loss=3.923, var=0.025, sparse=1.00]hard phase:  66%|██████▋   | 73/110 [06:11<02:15,  3.65s/it, loss=3.448, var=0.024, sparse=1.00]hard phase:  67%|██████▋   | 74/110 [06:11<02:09,  3.60s/it, loss=3.448, var=0.024, sparse=1.00]hard phase:  67%|██████▋   | 74/110 [06:15<02:09,  3.60s/it, loss=3.561, var=0.022, sparse=1.00]hard phase:  68%|██████▊   | 75/110 [06:15<02:04,  3.56s/it, loss=3.561, var=0.022, sparse=1.00]hard phase:  68%|██████▊   | 75/110 [06:18<02:04,  3.56s/it, loss=3.633, var=0.023, sparse=1.00]hard phase:  69%|██████▉   | 76/110 [06:18<02:01,  3.56s/it, loss=3.633, var=0.023, sparse=1.00]hard phase:  69%|██████▉   | 76/110 [06:22<02:01,  3.56s/it, loss=5.248, var=0.088, sparse=1.00]hard phase:  70%|███████   | 77/110 [06:22<01:56,  3.54s/it, loss=5.248, var=0.088, sparse=1.00]hard phase:  70%|███████   | 77/110 [06:25<01:56,  3.54s/it, loss=3.756, var=0.014, sparse=1.00]hard phase:  71%|███████   | 78/110 [06:25<01:52,  3.53s/it, loss=3.756, var=0.014, sparse=1.00]hard phase:  71%|███████   | 78/110 [06:29<01:52,  3.53s/it, loss=3.197, var=0.018, sparse=1.00]hard phase:  72%|███████▏  | 79/110 [06:29<01:49,  3.52s/it, loss=3.197, var=0.018, sparse=1.00]hard phase:  72%|███████▏  | 79/110 [06:32<01:49,  3.52s/it, loss=3.523, var=0.023, sparse=1.00]hard phase:  73%|███████▎  | 80/110 [06:32<01:45,  3.51s/it, loss=3.523, var=0.023, sparse=1.00]hard phase:  73%|███████▎  | 80/110 [06:36<01:45,  3.51s/it, loss=3.245, var=0.021, sparse=1.00]hard phase:  74%|███████▎  | 81/110 [06:36<01:41,  3.50s/it, loss=3.245, var=0.021, sparse=1.00]hard phase:  74%|███████▎  | 81/110 [06:39<01:41,  3.50s/it, loss=3.766, var=0.023, sparse=1.00]hard phase:  75%|███████▍  | 82/110 [06:39<01:37,  3.49s/it, loss=3.766, var=0.023, sparse=1.00]hard phase:  75%|███████▍  | 82/110 [06:42<01:37,  3.49s/it, loss=3.951, var=0.048, sparse=1.00]hard phase:  75%|███████▌  | 83/110 [06:42<01:34,  3.49s/it, loss=3.951, var=0.048, sparse=1.00]hard phase:  75%|███████▌  | 83/110 [06:46<01:34,  3.49s/it, loss=3.753, var=0.020, sparse=1.00]hard phase:  76%|███████▋  | 84/110 [06:46<01:30,  3.49s/it, loss=3.753, var=0.020, sparse=1.00]hard phase:  76%|███████▋  | 84/110 [06:49<01:30,  3.49s/it, loss=3.508, var=0.029, sparse=1.00]hard phase:  77%|███████▋  | 85/110 [06:49<01:27,  3.48s/it, loss=3.508, var=0.029, sparse=1.00]hard phase:  77%|███████▋  | 85/110 [06:53<01:27,  3.48s/it, loss=3.451, var=0.020, sparse=1.00]hard phase:  78%|███████▊  | 86/110 [06:53<01:23,  3.48s/it, loss=3.451, var=0.020, sparse=1.00]hard phase:  78%|███████▊  | 86/110 [06:56<01:23,  3.48s/it, loss=3.376, var=0.014, sparse=1.00]hard phase:  79%|███████▉  | 87/110 [06:56<01:20,  3.48s/it, loss=3.376, var=0.014, sparse=1.00]hard phase:  79%|███████▉  | 87/110 [07:00<01:20,  3.48s/it, loss=3.205, var=0.010, sparse=1.00]hard phase:  80%|████████  | 88/110 [07:00<01:16,  3.48s/it, loss=3.205, var=0.010, sparse=1.00]hard phase:  80%|████████  | 88/110 [07:03<01:16,  3.48s/it, loss=3.775, var=0.035, sparse=1.00]hard phase:  81%|████████  | 89/110 [07:03<01:13,  3.48s/it, loss=3.775, var=0.035, sparse=1.00]hard phase:  81%|████████  | 89/110 [07:07<01:13,  3.48s/it, loss=3.040, var=0.008, sparse=1.00]hard phase:  82%|████████▏ | 90/110 [07:07<01:09,  3.48s/it, loss=3.040, var=0.008, sparse=1.00]hard phase:  82%|████████▏ | 90/110 [07:10<01:09,  3.48s/it, loss=3.262, var=0.031, sparse=1.00]hard phase:  83%|████████▎ | 91/110 [07:10<01:06,  3.48s/it, loss=3.262, var=0.031, sparse=1.00]hard phase:  83%|████████▎ | 91/110 [07:14<01:06,  3.48s/it, loss=3.086, var=0.016, sparse=1.00]hard phase:  84%|████████▎ | 92/110 [07:14<01:02,  3.48s/it, loss=3.086, var=0.016, sparse=1.00]hard phase:  84%|████████▎ | 92/110 [07:17<01:02,  3.48s/it, loss=3.485, var=0.012, sparse=1.00]hard phase:  85%|████████▍ | 93/110 [07:17<00:59,  3.49s/it, loss=3.485, var=0.012, sparse=1.00]hard phase:  85%|████████▍ | 93/110 [07:21<00:59,  3.49s/it, loss=3.433, var=0.018, sparse=1.00]hard phase:  85%|████████▌ | 94/110 [07:21<00:55,  3.50s/it, loss=3.433, var=0.018, sparse=1.00]hard phase:  85%|████████▌ | 94/110 [07:24<00:55,  3.50s/it, loss=3.730, var=0.033, sparse=1.00]hard phase:  86%|████████▋ | 95/110 [07:24<00:52,  3.49s/it, loss=3.730, var=0.033, sparse=1.00]hard phase:  86%|████████▋ | 95/110 [07:28<00:52,  3.49s/it, loss=3.348, var=0.018, sparse=1.00]hard phase:  87%|████████▋ | 96/110 [07:28<00:48,  3.49s/it, loss=3.348, var=0.018, sparse=1.00]hard phase:  87%|████████▋ | 96/110 [07:31<00:48,  3.49s/it, loss=3.377, var=0.024, sparse=1.00]hard phase:  88%|████████▊ | 97/110 [07:31<00:45,  3.49s/it, loss=3.377, var=0.024, sparse=1.00]hard phase:  88%|████████▊ | 97/110 [07:35<00:45,  3.49s/it, loss=3.351, var=0.013, sparse=1.00]hard phase:  89%|████████▉ | 98/110 [07:35<00:41,  3.48s/it, loss=3.351, var=0.013, sparse=1.00]hard phase:  89%|████████▉ | 98/110 [07:38<00:41,  3.48s/it, loss=3.845, var=0.035, sparse=1.00]hard phase:  90%|█████████ | 99/110 [07:38<00:38,  3.49s/it, loss=3.845, var=0.035, sparse=1.00]hard phase:  90%|█████████ | 99/110 [07:42<00:38,  3.49s/it, loss=4.380, var=0.049, sparse=1.00]hard phase:  91%|█████████ | 100/110 [07:42<00:34,  3.49s/it, loss=4.380, var=0.049, sparse=1.00]hard phase:  91%|█████████ | 100/110 [07:45<00:34,  3.49s/it, loss=3.244, var=0.014, sparse=1.00]hard phase:  92%|█████████▏| 101/110 [07:45<00:31,  3.48s/it, loss=3.244, var=0.014, sparse=1.00]hard phase:  92%|█████████▏| 101/110 [07:49<00:31,  3.48s/it, loss=3.452, var=0.016, sparse=1.00]hard phase:  93%|█████████▎| 102/110 [07:49<00:27,  3.48s/it, loss=3.452, var=0.016, sparse=1.00]hard phase:  93%|█████████▎| 102/110 [07:52<00:27,  3.48s/it, loss=3.603, var=0.020, sparse=1.00]hard phase:  94%|█████████▎| 103/110 [07:52<00:24,  3.48s/it, loss=3.603, var=0.020, sparse=1.00]hard phase:  94%|█████████▎| 103/110 [07:56<00:24,  3.48s/it, loss=4.297, var=0.024, sparse=1.00]hard phase:  95%|█████████▍| 104/110 [07:56<00:20,  3.48s/it, loss=4.297, var=0.024, sparse=1.00]hard phase:  95%|█████████▍| 104/110 [07:59<00:20,  3.48s/it, loss=4.254, var=0.027, sparse=1.00]hard phase:  95%|█████████▌| 105/110 [07:59<00:17,  3.48s/it, loss=4.254, var=0.027, sparse=1.00]hard phase:  95%|█████████▌| 105/110 [08:03<00:17,  3.48s/it, loss=3.696, var=0.033, sparse=1.00]hard phase:  96%|█████████▋| 106/110 [08:03<00:13,  3.48s/it, loss=3.696, var=0.033, sparse=1.00]hard phase:  96%|█████████▋| 106/110 [08:06<00:13,  3.48s/it, loss=4.472, var=0.039, sparse=1.00]hard phase:  97%|█████████▋| 107/110 [08:06<00:10,  3.48s/it, loss=4.472, var=0.039, sparse=1.00]hard phase:  97%|█████████▋| 107/110 [08:10<00:10,  3.48s/it, loss=4.484, var=0.052, sparse=1.00]hard phase:  98%|█████████▊| 108/110 [08:10<00:06,  3.48s/it, loss=4.484, var=0.052, sparse=1.00]hard phase:  98%|█████████▊| 108/110 [08:13<00:06,  3.48s/it, loss=3.830, var=0.039, sparse=1.00]hard phase:  99%|█████████▉| 109/110 [08:13<00:03,  3.48s/it, loss=3.830, var=0.039, sparse=1.00]hard phase:  99%|█████████▉| 109/110 [08:17<00:03,  3.48s/it, loss=5.816, var=0.065, sparse=1.00]hard phase: 100%|██████████| 110/110 [08:17<00:00,  3.48s/it, loss=5.816, var=0.065, sparse=1.00]hard phase: 100%|██████████| 110/110 [08:17<00:00,  4.52s/it, loss=5.816, var=0.065, sparse=1.00]

======================================================================
TRAINING V-JEPA v2 (COMPARISON)
======================================================================

============================================================
Phase 1/1: HARD
============================================================
hard phase:   0%|          | 0/110 [00:00<?, ?it/s]hard phase:   0%|          | 0/110 [00:13<?, ?it/s, loss=29.095, var=0.980, sparse=1.00]hard phase:   1%|          | 1/110 [00:13<23:46, 13.08s/it, loss=29.095, var=0.980, sparse=1.00]hard phase:   1%|          | 1/110 [00:26<23:46, 13.08s/it, loss=8.320, var=0.078, sparse=1.00] hard phase:   2%|▏         | 2/110 [00:26<23:23, 12.99s/it, loss=8.320, var=0.078, sparse=1.00]hard phase:   2%|▏         | 2/110 [00:38<23:23, 12.99s/it, loss=4.696, var=0.035, sparse=1.00]hard phase:   3%|▎         | 3/110 [00:38<23:06, 12.96s/it, loss=4.696, var=0.035, sparse=1.00]hard phase:   3%|▎         | 3/110 [00:51<23:06, 12.96s/it, loss=4.580, var=0.049, sparse=1.00]hard phase:   4%|▎         | 4/110 [00:51<22:52, 12.94s/it, loss=4.580, var=0.049, sparse=1.00]hard phase:   4%|▎         | 4/110 [01:04<22:52, 12.94s/it, loss=4.243, var=0.043, sparse=1.00]hard phase:   5%|▍         | 5/110 [01:04<22:45, 13.00s/it, loss=4.243, var=0.043, sparse=1.00]hard phase:   5%|▍         | 5/110 [01:17<22:45, 13.00s/it, loss=5.327, var=0.044, sparse=1.00]hard phase:   5%|▌         | 6/110 [01:17<22:29, 12.98s/it, loss=5.327, var=0.044, sparse=1.00]hard phase:   5%|▌         | 6/110 [01:30<22:29, 12.98s/it, loss=3.992, var=0.028, sparse=1.00]hard phase:   6%|▋         | 7/110 [01:30<22:15, 12.97s/it, loss=3.992, var=0.028, sparse=1.00]hard phase:   6%|▋         | 7/110 [01:43<22:15, 12.97s/it, loss=4.754, var=0.040, sparse=1.00]hard phase:   7%|▋         | 8/110 [01:43<22:01, 12.95s/it, loss=4.754, var=0.040, sparse=1.00]hard phase:   7%|▋         | 8/110 [01:56<22:01, 12.95s/it, loss=4.644, var=0.036, sparse=1.00]hard phase:   8%|▊         | 9/110 [01:56<21:47, 12.95s/it, loss=4.644, var=0.036, sparse=1.00]hard phase:   8%|▊         | 9/110 [02:09<21:47, 12.95s/it, loss=4.955, var=0.053, sparse=1.00]hard phase:   9%|▉         | 10/110 [02:09<21:38, 12.99s/it, loss=4.955, var=0.053, sparse=1.00]hard phase:   9%|▉         | 10/110 [02:22<21:38, 12.99s/it, loss=4.649, var=0.038, sparse=1.00]hard phase:  10%|█         | 11/110 [02:22<21:24, 12.97s/it, loss=4.649, var=0.038, sparse=1.00]hard phase:  10%|█         | 11/110 [02:35<21:24, 12.97s/it, loss=3.746, var=0.022, sparse=1.00]hard phase:  11%|█         | 12/110 [02:35<21:09, 12.96s/it, loss=3.746, var=0.022, sparse=1.00]hard phase:  11%|█         | 12/110 [02:48<21:09, 12.96s/it, loss=3.884, var=0.021, sparse=1.00]hard phase:  12%|█▏        | 13/110 [02:48<20:55, 12.94s/it, loss=3.884, var=0.021, sparse=1.00]hard phase:  12%|█▏        | 13/110 [03:01<20:55, 12.94s/it, loss=4.341, var=0.056, sparse=1.00]hard phase:  13%|█▎        | 14/110 [03:01<20:43, 12.95s/it, loss=4.341, var=0.056, sparse=1.00]hard phase:  13%|█▎        | 14/110 [03:14<20:43, 12.95s/it, loss=4.786, var=0.037, sparse=1.00]hard phase:  14%|█▎        | 15/110 [03:14<20:29, 12.95s/it, loss=4.786, var=0.037, sparse=1.00]hard phase:  14%|█▎        | 15/110 [03:27<20:29, 12.95s/it, loss=3.958, var=0.025, sparse=1.00]hard phase:  15%|█▍        | 16/110 [03:27<20:15, 12.93s/it, loss=3.958, var=0.025, sparse=1.00]hard phase:  15%|█▍        | 16/110 [03:40<20:15, 12.93s/it, loss=3.763, var=0.031, sparse=1.00]hard phase:  15%|█▌        | 17/110 [03:40<20:02, 12.93s/it, loss=3.763, var=0.031, sparse=1.00]hard phase:  15%|█▌        | 17/110 [03:53<20:02, 12.93s/it, loss=3.742, var=0.024, sparse=1.00]hard phase:  16%|█▋        | 18/110 [03:53<19:51, 12.95s/it, loss=3.742, var=0.024, sparse=1.00]hard phase:  16%|█▋        | 18/110 [04:06<19:51, 12.95s/it, loss=3.421, var=0.021, sparse=1.00]hard phase:  17%|█▋        | 19/110 [04:06<19:52, 13.10s/it, loss=3.421, var=0.021, sparse=1.00]hard phase:  17%|█▋        | 19/110 [04:19<19:52, 13.10s/it, loss=3.083, var=0.011, sparse=1.00]hard phase:  18%|█▊        | 20/110 [04:19<19:34, 13.05s/it, loss=3.083, var=0.011, sparse=1.00]hard phase:  18%|█▊        | 20/110 [04:32<19:34, 13.05s/it, loss=3.970, var=0.029, sparse=1.00]hard phase:  19%|█▉        | 21/110 [04:32<19:17, 13.01s/it, loss=3.970, var=0.029, sparse=1.00]hard phase:  19%|█▉        | 21/110 [04:45<19:17, 13.01s/it, loss=4.328, var=0.017, sparse=1.00]hard phase:  20%|██        | 22/110 [04:45<19:12, 13.10s/it, loss=4.328, var=0.017, sparse=1.00]hard phase:  20%|██        | 22/110 [05:00<19:12, 13.10s/it, loss=3.733, var=0.031, sparse=1.00]hard phase:  21%|██        | 23/110 [05:00<19:41, 13.59s/it, loss=3.733, var=0.031, sparse=1.00]hard phase:  21%|██        | 23/110 [05:13<19:41, 13.59s/it, loss=3.456, var=0.025, sparse=1.00]hard phase:  22%|██▏       | 24/110 [05:13<19:15, 13.44s/it, loss=3.456, var=0.025, sparse=1.00]hard phase:  22%|██▏       | 24/110 [05:26<19:15, 13.44s/it, loss=3.448, var=0.014, sparse=1.00]hard phase:  23%|██▎       | 25/110 [05:26<18:50, 13.30s/it, loss=3.448, var=0.014, sparse=1.00]hard phase:  23%|██▎       | 25/110 [05:39<18:50, 13.30s/it, loss=3.592, var=0.035, sparse=1.00]hard phase:  24%|██▎       | 26/110 [05:39<18:28, 13.20s/it, loss=3.592, var=0.035, sparse=1.00]hard phase:  24%|██▎       | 26/110 [05:52<18:28, 13.20s/it, loss=3.355, var=0.015, sparse=1.00]hard phase:  25%|██▍       | 27/110 [05:52<18:10, 13.13s/it, loss=3.355, var=0.015, sparse=1.00]hard phase:  25%|██▍       | 27/110 [06:05<18:10, 13.13s/it, loss=3.438, var=0.019, sparse=1.00]hard phase:  25%|██▌       | 28/110 [06:05<17:57, 13.14s/it, loss=3.438, var=0.019, sparse=1.00]hard phase:  25%|██▌       | 28/110 [06:18<17:57, 13.14s/it, loss=3.940, var=0.023, sparse=1.00]hard phase:  26%|██▋       | 29/110 [06:18<17:40, 13.10s/it, loss=3.940, var=0.023, sparse=1.00]hard phase:  26%|██▋       | 29/110 [06:31<17:40, 13.10s/it, loss=4.331, var=0.034, sparse=1.00]hard phase:  27%|██▋       | 30/110 [06:31<17:25, 13.07s/it, loss=4.331, var=0.034, sparse=1.00]hard phase:  27%|██▋       | 30/110 [06:44<17:25, 13.07s/it, loss=3.711, var=0.023, sparse=1.00]hard phase:  28%|██▊       | 31/110 [06:44<17:10, 13.04s/it, loss=3.711, var=0.023, sparse=1.00]hard phase:  28%|██▊       | 31/110 [06:57<17:10, 13.04s/it, loss=3.393, var=0.021, sparse=1.00]hard phase:  29%|██▉       | 32/110 [06:57<16:55, 13.02s/it, loss=3.393, var=0.021, sparse=1.00]hard phase:  29%|██▉       | 32/110 [07:10<16:55, 13.02s/it, loss=3.136, var=0.016, sparse=1.00]hard phase:  30%|███       | 33/110 [07:10<16:43, 13.03s/it, loss=3.136, var=0.016, sparse=1.00]hard phase:  30%|███       | 33/110 [07:23<16:43, 13.03s/it, loss=3.550, var=0.029, sparse=1.00]hard phase:  31%|███       | 34/110 [07:23<16:28, 13.01s/it, loss=3.550, var=0.029, sparse=1.00]hard phase:  31%|███       | 34/110 [07:36<16:28, 13.01s/it, loss=3.773, var=0.012, sparse=1.00]hard phase:  32%|███▏      | 35/110 [07:36<16:15, 13.01s/it, loss=3.773, var=0.012, sparse=1.00]hard phase:  32%|███▏      | 35/110 [07:50<16:15, 13.01s/it, loss=3.453, var=0.019, sparse=1.00]hard phase:  33%|███▎      | 36/110 [07:50<16:11, 13.13s/it, loss=3.453, var=0.019, sparse=1.00]hard phase:  33%|███▎      | 36/110 [08:03<16:11, 13.13s/it, loss=3.821, var=0.018, sparse=1.00]hard phase:  34%|███▎      | 37/110 [08:03<16:02, 13.18s/it, loss=3.821, var=0.018, sparse=1.00]hard phase:  34%|███▎      | 37/110 [08:16<16:02, 13.18s/it, loss=3.479, var=0.014, sparse=1.00]hard phase:  35%|███▍      | 38/110 [08:16<15:45, 13.13s/it, loss=3.479, var=0.014, sparse=1.00]hard phase:  35%|███▍      | 38/110 [08:29<15:45, 13.13s/it, loss=4.534, var=0.039, sparse=1.00]hard phase:  35%|███▌      | 39/110 [08:29<15:28, 13.08s/it, loss=4.534, var=0.039, sparse=1.00]hard phase:  35%|███▌      | 39/110 [08:42<15:28, 13.08s/it, loss=3.953, var=0.023, sparse=1.00]hard phase:  36%|███▋      | 40/110 [08:42<15:13, 13.05s/it, loss=3.953, var=0.023, sparse=1.00]hard phase:  36%|███▋      | 40/110 [08:55<15:13, 13.05s/it, loss=3.590, var=0.018, sparse=1.00]hard phase:  37%|███▋      | 41/110 [08:55<14:58, 13.02s/it, loss=3.590, var=0.018, sparse=1.00]hard phase:  37%|███▋      | 41/110 [09:08<14:58, 13.02s/it, loss=3.624, var=0.022, sparse=1.00]hard phase:  38%|███▊      | 42/110 [09:08<14:46, 13.03s/it, loss=3.624, var=0.022, sparse=1.00]hard phase:  38%|███▊      | 42/110 [09:21<14:46, 13.03s/it, loss=3.177, var=0.010, sparse=1.00]hard phase:  39%|███▉      | 43/110 [09:21<14:31, 13.01s/it, loss=3.177, var=0.010, sparse=1.00]hard phase:  39%|███▉      | 43/110 [09:34<14:31, 13.01s/it, loss=3.621, var=0.035, sparse=1.00]hard phase:  40%|████      | 44/110 [09:34<14:18, 13.01s/it, loss=3.621, var=0.035, sparse=1.00]hard phase:  40%|████      | 44/110 [09:47<14:18, 13.01s/it, loss=4.762, var=0.054, sparse=1.00]hard phase:  41%|████      | 45/110 [09:47<14:04, 13.00s/it, loss=4.762, var=0.054, sparse=1.00]hard phase:  41%|████      | 45/110 [10:00<14:04, 13.00s/it, loss=3.975, var=0.014, sparse=1.00]hard phase:  42%|████▏     | 46/110 [10:00<13:53, 13.02s/it, loss=3.975, var=0.014, sparse=1.00]hard phase:  42%|████▏     | 46/110 [10:13<13:53, 13.02s/it, loss=2.964, var=0.009, sparse=1.00]hard phase:  43%|████▎     | 47/110 [10:13<13:40, 13.02s/it, loss=2.964, var=0.009, sparse=1.00]hard phase:  43%|████▎     | 47/110 [10:26<13:40, 13.02s/it, loss=3.805, var=0.027, sparse=1.00]hard phase:  44%|████▎     | 48/110 [10:26<13:26, 13.01s/it, loss=3.805, var=0.027, sparse=1.00]hard phase:  44%|████▎     | 48/110 [10:39<13:26, 13.01s/it, loss=3.598, var=0.020, sparse=1.00]hard phase:  45%|████▍     | 49/110 [10:39<13:13, 13.00s/it, loss=3.598, var=0.020, sparse=1.00]hard phase:  45%|████▍     | 49/110 [10:52<13:13, 13.00s/it, loss=3.511, var=0.040, sparse=1.00]hard phase:  45%|████▌     | 50/110 [10:52<12:59, 12.99s/it, loss=3.511, var=0.040, sparse=1.00]hard phase:  45%|████▌     | 50/110 [11:05<12:59, 12.99s/it, loss=3.358, var=0.020, sparse=1.00]hard phase:  46%|████▋     | 51/110 [11:05<12:49, 13.04s/it, loss=3.358, var=0.020, sparse=1.00]hard phase:  46%|████▋     | 51/110 [11:18<12:49, 13.04s/it, loss=3.662, var=0.022, sparse=1.00]hard phase:  47%|████▋     | 52/110 [11:18<12:35, 13.02s/it, loss=3.662, var=0.022, sparse=1.00]hard phase:  47%|████▋     | 52/110 [11:31<12:35, 13.02s/it, loss=3.663, var=0.023, sparse=1.00]hard phase:  48%|████▊     | 53/110 [11:31<12:21, 13.01s/it, loss=3.663, var=0.023, sparse=1.00]hard phase:  48%|████▊     | 53/110 [11:44<12:21, 13.01s/it, loss=3.392, var=0.017, sparse=1.00]hard phase:  49%|████▉     | 54/110 [11:44<12:07, 13.00s/it, loss=3.392, var=0.017, sparse=1.00]hard phase:  49%|████▉     | 54/110 [11:57<12:07, 13.00s/it, loss=3.101, var=0.020, sparse=1.00]hard phase:  50%|█████     | 55/110 [11:57<11:54, 12.99s/it, loss=3.101, var=0.020, sparse=1.00]hard phase:  50%|█████     | 55/110 [12:10<11:54, 12.99s/it, loss=3.064, var=0.013, sparse=1.00]hard phase:  51%|█████     | 56/110 [12:10<11:42, 13.00s/it, loss=3.064, var=0.013, sparse=1.00]hard phase:  51%|█████     | 56/110 [12:23<11:42, 13.00s/it, loss=3.455, var=0.014, sparse=1.00]hard phase:  52%|█████▏    | 57/110 [12:23<11:28, 13.00s/it, loss=3.455, var=0.014, sparse=1.00]hard phase:  52%|█████▏    | 57/110 [12:36<11:28, 13.00s/it, loss=3.328, var=0.018, sparse=1.00]hard phase:  53%|█████▎    | 58/110 [12:36<11:15, 12.99s/it, loss=3.328, var=0.018, sparse=1.00]hard phase:  53%|█████▎    | 58/110 [12:49<11:15, 12.99s/it, loss=3.315, var=0.025, sparse=1.00]hard phase:  54%|█████▎    | 59/110 [12:49<11:02, 12.98s/it, loss=3.315, var=0.025, sparse=1.00]hard phase:  54%|█████▎    | 59/110 [13:02<11:02, 12.98s/it, loss=3.638, var=0.014, sparse=1.00]hard phase:  55%|█████▍    | 60/110 [13:02<10:50, 13.02s/it, loss=3.638, var=0.014, sparse=1.00]hard phase:  55%|█████▍    | 60/110 [13:15<10:50, 13.02s/it, loss=3.580, var=0.033, sparse=1.00]hard phase:  55%|█████▌    | 61/110 [13:15<10:37, 13.01s/it, loss=3.580, var=0.033, sparse=1.00]hard phase:  55%|█████▌    | 61/110 [13:28<10:37, 13.01s/it, loss=3.248, var=0.016, sparse=1.00]hard phase:  56%|█████▋    | 62/110 [13:28<10:24, 13.01s/it, loss=3.248, var=0.016, sparse=1.00]hard phase:  56%|█████▋    | 62/110 [13:41<10:24, 13.01s/it, loss=3.474, var=0.029, sparse=1.00]hard phase:  57%|█████▋    | 63/110 [13:41<10:11, 13.00s/it, loss=3.474, var=0.029, sparse=1.00]hard phase:  57%|█████▋    | 63/110 [13:54<10:11, 13.00s/it, loss=3.065, var=0.010, sparse=1.00]hard phase:  58%|█████▊    | 64/110 [13:54<09:57, 12.99s/it, loss=3.065, var=0.010, sparse=1.00]hard phase:  58%|█████▊    | 64/110 [14:07<09:57, 12.99s/it, loss=3.203, var=0.025, sparse=1.00]hard phase:  59%|█████▉    | 65/110 [14:07<09:45, 13.02s/it, loss=3.203, var=0.025, sparse=1.00]hard phase:  59%|█████▉    | 65/110 [14:21<09:45, 13.02s/it, loss=3.274, var=0.023, sparse=1.00]hard phase:  60%|██████    | 66/110 [14:21<09:39, 13.16s/it, loss=3.274, var=0.023, sparse=1.00]hard phase:  60%|██████    | 66/110 [14:35<09:39, 13.16s/it, loss=3.426, var=0.018, sparse=1.00]hard phase:  61%|██████    | 67/110 [14:35<09:38, 13.45s/it, loss=3.426, var=0.018, sparse=1.00]hard phase:  61%|██████    | 67/110 [14:50<09:38, 13.45s/it, loss=3.502, var=0.015, sparse=1.00]hard phase:  62%|██████▏   | 68/110 [14:50<09:43, 13.89s/it, loss=3.502, var=0.015, sparse=1.00]hard phase:  62%|██████▏   | 68/110 [15:04<09:43, 13.89s/it, loss=3.351, var=0.017, sparse=1.00]hard phase:  63%|██████▎   | 69/110 [15:04<09:32, 13.96s/it, loss=3.351, var=0.017, sparse=1.00]hard phase:  63%|██████▎   | 69/110 [15:21<09:32, 13.96s/it, loss=3.382, var=0.028, sparse=1.00]hard phase:  64%|██████▎   | 70/110 [15:21<09:55, 14.89s/it, loss=3.382, var=0.028, sparse=1.00]hard phase:  64%|██████▎   | 70/110 [15:40<09:55, 14.89s/it, loss=3.069, var=0.017, sparse=1.00]hard phase:  65%|██████▍   | 71/110 [15:40<10:30, 16.17s/it, loss=3.069, var=0.017, sparse=1.00]hard phase:  65%|██████▍   | 71/110 [15:58<10:30, 16.17s/it, loss=3.399, var=0.024, sparse=1.00]hard phase:  65%|██████▌   | 72/110 [15:58<10:32, 16.66s/it, loss=3.399, var=0.024, sparse=1.00]hard phase:  65%|██████▌   | 72/110 [16:14<10:32, 16.66s/it, loss=2.865, var=0.010, sparse=1.00]hard phase:  66%|██████▋   | 73/110 [16:14<10:15, 16.62s/it, loss=2.865, var=0.010, sparse=1.00]hard phase:  66%|██████▋   | 73/110 [16:33<10:15, 16.62s/it, loss=3.355, var=0.021, sparse=1.00]hard phase:  67%|██████▋   | 74/110 [16:33<10:24, 17.34s/it, loss=3.355, var=0.021, sparse=1.00]hard phase:  67%|██████▋   | 74/110 [16:47<10:24, 17.34s/it, loss=3.158, var=0.024, sparse=1.00]hard phase:  68%|██████▊   | 75/110 [16:47<09:26, 16.19s/it, loss=3.158, var=0.024, sparse=1.00]hard phase:  68%|██████▊   | 75/110 [17:00<09:26, 16.19s/it, loss=3.089, var=0.013, sparse=1.00]hard phase:  69%|██████▉   | 76/110 [17:00<08:37, 15.23s/it, loss=3.089, var=0.013, sparse=1.00]hard phase:  69%|██████▉   | 76/110 [17:13<08:37, 15.23s/it, loss=3.159, var=0.019, sparse=1.00]hard phase:  70%|███████   | 77/110 [17:13<08:02, 14.62s/it, loss=3.159, var=0.019, sparse=1.00]hard phase:  70%|███████   | 77/110 [17:26<08:02, 14.62s/it, loss=2.990, var=0.014, sparse=1.00]hard phase:  71%|███████   | 78/110 [17:26<07:32, 14.14s/it, loss=2.990, var=0.014, sparse=1.00]hard phase:  71%|███████   | 78/110 [17:39<07:32, 14.14s/it, loss=3.128, var=0.018, sparse=1.00]hard phase:  72%|███████▏  | 79/110 [17:39<07:07, 13.79s/it, loss=3.128, var=0.018, sparse=1.00]hard phase:  72%|███████▏  | 79/110 [17:52<07:07, 13.79s/it, loss=3.564, var=0.020, sparse=1.00]hard phase:  73%|███████▎  | 80/110 [17:52<06:46, 13.56s/it, loss=3.564, var=0.020, sparse=1.00]hard phase:  73%|███████▎  | 80/110 [18:05<06:46, 13.56s/it, loss=3.312, var=0.008, sparse=1.00]hard phase:  74%|███████▎  | 81/110 [18:05<06:29, 13.43s/it, loss=3.312, var=0.008, sparse=1.00]hard phase:  74%|███████▎  | 81/110 [18:18<06:29, 13.43s/it, loss=3.244, var=0.023, sparse=1.00]hard phase:  75%|███████▍  | 82/110 [18:18<06:12, 13.31s/it, loss=3.244, var=0.023, sparse=1.00]hard phase:  75%|███████▍  | 82/110 [18:31<06:12, 13.31s/it, loss=3.530, var=0.014, sparse=1.00]hard phase:  75%|███████▌  | 83/110 [18:31<05:56, 13.21s/it, loss=3.530, var=0.014, sparse=1.00]hard phase:  75%|███████▌  | 83/110 [18:44<05:56, 13.21s/it, loss=3.385, var=0.028, sparse=1.00]hard phase:  76%|███████▋  | 84/110 [18:44<05:41, 13.15s/it, loss=3.385, var=0.028, sparse=1.00]hard phase:  76%|███████▋  | 84/110 [18:57<05:41, 13.15s/it, loss=3.452, var=0.021, sparse=1.00]hard phase:  77%|███████▋  | 85/110 [18:57<05:27, 13.10s/it, loss=3.452, var=0.021, sparse=1.00]hard phase:  77%|███████▋  | 85/110 [19:10<05:27, 13.10s/it, loss=3.608, var=0.024, sparse=1.00]hard phase:  78%|███████▊  | 86/110 [19:10<05:14, 13.12s/it, loss=3.608, var=0.024, sparse=1.00]hard phase:  78%|███████▊  | 86/110 [19:23<05:14, 13.12s/it, loss=3.548, var=0.017, sparse=1.00]hard phase:  79%|███████▉  | 87/110 [19:23<05:00, 13.08s/it, loss=3.548, var=0.017, sparse=1.00]hard phase:  79%|███████▉  | 87/110 [19:36<05:00, 13.08s/it, loss=3.508, var=0.016, sparse=1.00]hard phase:  80%|████████  | 88/110 [19:36<04:47, 13.06s/it, loss=3.508, var=0.016, sparse=1.00]hard phase:  80%|████████  | 88/110 [19:49<04:47, 13.06s/it, loss=3.102, var=0.018, sparse=1.00]hard phase:  81%|████████  | 89/110 [19:49<04:33, 13.03s/it, loss=3.102, var=0.018, sparse=1.00]hard phase:  81%|████████  | 89/110 [20:02<04:33, 13.03s/it, loss=3.178, var=0.011, sparse=1.00]hard phase:  82%|████████▏ | 90/110 [20:02<04:21, 13.07s/it, loss=3.178, var=0.011, sparse=1.00]hard phase:  82%|████████▏ | 90/110 [20:15<04:21, 13.07s/it, loss=3.526, var=0.015, sparse=1.00]hard phase:  83%|████████▎ | 91/110 [20:15<04:08, 13.06s/it, loss=3.526, var=0.015, sparse=1.00]hard phase:  83%|████████▎ | 91/110 [20:28<04:08, 13.06s/it, loss=3.335, var=0.021, sparse=1.00]hard phase:  84%|████████▎ | 92/110 [20:28<03:54, 13.05s/it, loss=3.335, var=0.021, sparse=1.00]hard phase:  84%|████████▎ | 92/110 [20:41<03:54, 13.05s/it, loss=3.146, var=0.018, sparse=1.00]hard phase:  85%|████████▍ | 93/110 [20:41<03:41, 13.03s/it, loss=3.146, var=0.018, sparse=1.00]hard phase:  85%|████████▍ | 93/110 [20:54<03:41, 13.03s/it, loss=3.403, var=0.016, sparse=1.00]hard phase:  85%|████████▌ | 94/110 [20:54<03:28, 13.01s/it, loss=3.403, var=0.016, sparse=1.00]hard phase:  85%|████████▌ | 94/110 [21:08<03:28, 13.01s/it, loss=3.199, var=0.017, sparse=1.00]hard phase:  86%|████████▋ | 95/110 [21:08<03:16, 13.07s/it, loss=3.199, var=0.017, sparse=1.00]hard phase:  86%|████████▋ | 95/110 [21:21<03:16, 13.07s/it, loss=3.331, var=0.008, sparse=1.00]hard phase:  87%|████████▋ | 96/110 [21:21<03:03, 13.08s/it, loss=3.331, var=0.008, sparse=1.00]hard phase:  87%|████████▋ | 96/110 [21:36<03:03, 13.08s/it, loss=2.849, var=0.010, sparse=1.00]hard phase:  88%|████████▊ | 97/110 [21:36<02:56, 13.59s/it, loss=2.849, var=0.010, sparse=1.00]hard phase:  88%|████████▊ | 97/110 [21:55<02:56, 13.59s/it, loss=2.879, var=0.011, sparse=1.00]hard phase:  89%|████████▉ | 98/110 [21:55<03:04, 15.37s/it, loss=2.879, var=0.011, sparse=1.00]hard phase:  89%|████████▉ | 98/110 [22:10<03:04, 15.37s/it, loss=3.207, var=0.013, sparse=1.00]hard phase:  90%|█████████ | 99/110 [22:10<02:48, 15.33s/it, loss=3.207, var=0.013, sparse=1.00]hard phase:  90%|█████████ | 99/110 [22:24<02:48, 15.33s/it, loss=3.020, var=0.009, sparse=1.00]hard phase:  91%|█████████ | 100/110 [22:24<02:28, 14.88s/it, loss=3.020, var=0.009, sparse=1.00]hard phase:  91%|█████████ | 100/110 [22:37<02:28, 14.88s/it, loss=3.194, var=0.018, sparse=1.00]hard phase:  92%|█████████▏| 101/110 [22:37<02:08, 14.29s/it, loss=3.194, var=0.018, sparse=1.00]hard phase:  92%|█████████▏| 101/110 [22:51<02:08, 14.29s/it, loss=3.275, var=0.014, sparse=1.00]hard phase:  93%|█████████▎| 102/110 [22:51<01:52, 14.05s/it, loss=3.275, var=0.014, sparse=1.00]hard phase:  93%|█████████▎| 102/110 [23:04<01:52, 14.05s/it, loss=2.945, var=0.016, sparse=1.00]hard phase:  94%|█████████▎| 103/110 [23:04<01:37, 13.88s/it, loss=2.945, var=0.016, sparse=1.00]hard phase:  94%|█████████▎| 103/110 [23:22<01:37, 13.88s/it, loss=2.980, var=0.010, sparse=1.00]hard phase:  95%|█████████▍| 104/110 [23:22<01:31, 15.24s/it, loss=2.980, var=0.010, sparse=1.00]hard phase:  95%|█████████▍| 104/110 [23:35<01:31, 15.24s/it, loss=3.220, var=0.026, sparse=1.00]hard phase:  95%|█████████▌| 105/110 [23:35<01:12, 14.50s/it, loss=3.220, var=0.026, sparse=1.00]hard phase:  95%|█████████▌| 105/110 [23:49<01:12, 14.50s/it, loss=3.510, var=0.020, sparse=1.00]hard phase:  96%|█████████▋| 106/110 [23:49<00:56, 14.17s/it, loss=3.510, var=0.020, sparse=1.00]hard phase:  96%|█████████▋| 106/110 [24:02<00:56, 14.17s/it, loss=3.890, var=0.033, sparse=1.00]hard phase:  97%|█████████▋| 107/110 [24:02<00:41, 13.86s/it, loss=3.890, var=0.033, sparse=1.00]hard phase:  97%|█████████▋| 107/110 [24:15<00:41, 13.86s/it, loss=3.061, var=0.011, sparse=1.00]hard phase:  98%|█████████▊| 108/110 [24:15<00:27, 13.57s/it, loss=3.061, var=0.011, sparse=1.00]hard phase:  98%|█████████▊| 108/110 [24:27<00:27, 13.57s/it, loss=3.322, var=0.019, sparse=1.00]hard phase:  99%|█████████▉| 109/110 [24:27<00:13, 13.28s/it, loss=3.322, var=0.019, sparse=1.00]hard phase:  99%|█████████▉| 109/110 [24:40<00:13, 13.28s/it, loss=3.391, var=0.025, sparse=1.00]hard phase: 100%|██████████| 110/110 [24:40<00:00, 13.09s/it, loss=3.391, var=0.025, sparse=1.00]hard phase: 100%|██████████| 110/110 [24:40<00:00, 13.46s/it, loss=3.391, var=0.025, sparse=1.00]
/Users/blap/AIphant/venv/lib/python3.14/site-packages/sklearn/utils/extmath.py:350: RuntimeWarning: divide by zero encountered in matmul
  Q, _ = normalizer(A @ Q)
/Users/blap/AIphant/venv/lib/python3.14/site-packages/sklearn/utils/extmath.py:350: RuntimeWarning: overflow encountered in matmul
  Q, _ = normalizer(A @ Q)
/Users/blap/AIphant/venv/lib/python3.14/site-packages/sklearn/utils/extmath.py:350: RuntimeWarning: invalid value encountered in matmul
  Q, _ = normalizer(A @ Q)
/Users/blap/AIphant/venv/lib/python3.14/site-packages/sklearn/utils/extmath.py:351: RuntimeWarning: divide by zero encountered in matmul
  Q, _ = normalizer(A.T @ Q)
/Users/blap/AIphant/venv/lib/python3.14/site-packages/sklearn/utils/extmath.py:351: RuntimeWarning: overflow encountered in matmul
  Q, _ = normalizer(A.T @ Q)
/Users/blap/AIphant/venv/lib/python3.14/site-packages/sklearn/utils/extmath.py:351: RuntimeWarning: invalid value encountered in matmul
  Q, _ = normalizer(A.T @ Q)
/Users/blap/AIphant/venv/lib/python3.14/site-packages/sklearn/utils/extmath.py:355: RuntimeWarning: divide by zero encountered in matmul
  Q, _ = qr_normalizer(A @ Q)
/Users/blap/AIphant/venv/lib/python3.14/site-packages/sklearn/utils/extmath.py:355: RuntimeWarning: overflow encountered in matmul
  Q, _ = qr_normalizer(A @ Q)
/Users/blap/AIphant/venv/lib/python3.14/site-packages/sklearn/utils/extmath.py:355: RuntimeWarning: invalid value encountered in matmul
  Q, _ = qr_normalizer(A @ Q)
/Users/blap/AIphant/venv/lib/python3.14/site-packages/sklearn/utils/extmath.py:577: RuntimeWarning: divide by zero encountered in matmul
  B = Q.T @ M
/Users/blap/AIphant/venv/lib/python3.14/site-packages/sklearn/utils/extmath.py:577: RuntimeWarning: overflow encountered in matmul
  B = Q.T @ M
/Users/blap/AIphant/venv/lib/python3.14/site-packages/sklearn/utils/extmath.py:577: RuntimeWarning: invalid value encountered in matmul
  B = Q.T @ M
/Users/blap/AIphant/venv/lib/python3.14/site-packages/sklearn/utils/extmath.py:590: RuntimeWarning: divide by zero encountered in matmul
  U = Q @ Uhat
/Users/blap/AIphant/venv/lib/python3.14/site-packages/sklearn/utils/extmath.py:590: RuntimeWarning: overflow encountered in matmul
  U = Q @ Uhat
/Users/blap/AIphant/venv/lib/python3.14/site-packages/sklearn/utils/extmath.py:590: RuntimeWarning: invalid value encountered in matmul
  U = Q @ Uhat
/Users/blap/AIphant/venv/lib/python3.14/site-packages/sklearn/utils/extmath.py:350: RuntimeWarning: divide by zero encountered in matmul
  Q, _ = normalizer(A @ Q)
/Users/blap/AIphant/venv/lib/python3.14/site-packages/sklearn/utils/extmath.py:350: RuntimeWarning: overflow encountered in matmul
  Q, _ = normalizer(A @ Q)
/Users/blap/AIphant/venv/lib/python3.14/site-packages/sklearn/utils/extmath.py:350: RuntimeWarning: invalid value encountered in matmul
  Q, _ = normalizer(A @ Q)
/Users/blap/AIphant/venv/lib/python3.14/site-packages/sklearn/utils/extmath.py:351: RuntimeWarning: divide by zero encountered in matmul
  Q, _ = normalizer(A.T @ Q)
/Users/blap/AIphant/venv/lib/python3.14/site-packages/sklearn/utils/extmath.py:351: RuntimeWarning: overflow encountered in matmul
  Q, _ = normalizer(A.T @ Q)
/Users/blap/AIphant/venv/lib/python3.14/site-packages/sklearn/utils/extmath.py:351: RuntimeWarning: invalid value encountered in matmul
  Q, _ = normalizer(A.T @ Q)
/Users/blap/AIphant/venv/lib/python3.14/site-packages/sklearn/utils/extmath.py:355: RuntimeWarning: divide by zero encountered in matmul
  Q, _ = qr_normalizer(A @ Q)
/Users/blap/AIphant/venv/lib/python3.14/site-packages/sklearn/utils/extmath.py:355: RuntimeWarning: overflow encountered in matmul
  Q, _ = qr_normalizer(A @ Q)
/Users/blap/AIphant/venv/lib/python3.14/site-packages/sklearn/utils/extmath.py:355: RuntimeWarning: invalid value encountered in matmul
  Q, _ = qr_normalizer(A @ Q)
/Users/blap/AIphant/venv/lib/python3.14/site-packages/sklearn/utils/extmath.py:577: RuntimeWarning: divide by zero encountered in matmul
  B = Q.T @ M
/Users/blap/AIphant/venv/lib/python3.14/site-packages/sklearn/utils/extmath.py:577: RuntimeWarning: overflow encountered in matmul
  B = Q.T @ M
/Users/blap/AIphant/venv/lib/python3.14/site-packages/sklearn/utils/extmath.py:577: RuntimeWarning: invalid value encountered in matmul
  B = Q.T @ M
/Users/blap/AIphant/venv/lib/python3.14/site-packages/sklearn/utils/extmath.py:590: RuntimeWarning: divide by zero encountered in matmul
  U = Q @ Uhat
/Users/blap/AIphant/venv/lib/python3.14/site-packages/sklearn/utils/extmath.py:590: RuntimeWarning: overflow encountered in matmul
  U = Q @ Uhat
/Users/blap/AIphant/venv/lib/python3.14/site-packages/sklearn/utils/extmath.py:590: RuntimeWarning: invalid value encountered in matmul
  U = Q @ Uhat
/Users/blap/AIphant/venv/lib/python3.14/site-packages/sklearn/utils/extmath.py:350: RuntimeWarning: divide by zero encountered in matmul
  Q, _ = normalizer(A @ Q)
/Users/blap/AIphant/venv/lib/python3.14/site-packages/sklearn/utils/extmath.py:350: RuntimeWarning: overflow encountered in matmul
  Q, _ = normalizer(A @ Q)
/Users/blap/AIphant/venv/lib/python3.14/site-packages/sklearn/utils/extmath.py:350: RuntimeWarning: invalid value encountered in matmul
  Q, _ = normalizer(A @ Q)
/Users/blap/AIphant/venv/lib/python3.14/site-packages/sklearn/utils/extmath.py:351: RuntimeWarning: divide by zero encountered in matmul
  Q, _ = normalizer(A.T @ Q)
/Users/blap/AIphant/venv/lib/python3.14/site-packages/sklearn/utils/extmath.py:351: RuntimeWarning: overflow encountered in matmul
  Q, _ = normalizer(A.T @ Q)
/Users/blap/AIphant/venv/lib/python3.14/site-packages/sklearn/utils/extmath.py:351: RuntimeWarning: invalid value encountered in matmul
  Q, _ = normalizer(A.T @ Q)
/Users/blap/AIphant/venv/lib/python3.14/site-packages/sklearn/utils/extmath.py:355: RuntimeWarning: divide by zero encountered in matmul
  Q, _ = qr_normalizer(A @ Q)
/Users/blap/AIphant/venv/lib/python3.14/site-packages/sklearn/utils/extmath.py:355: RuntimeWarning: overflow encountered in matmul
  Q, _ = qr_normalizer(A @ Q)
/Users/blap/AIphant/venv/lib/python3.14/site-packages/sklearn/utils/extmath.py:355: RuntimeWarning: invalid value encountered in matmul
  Q, _ = qr_normalizer(A @ Q)
/Users/blap/AIphant/venv/lib/python3.14/site-packages/sklearn/utils/extmath.py:577: RuntimeWarning: divide by zero encountered in matmul
  B = Q.T @ M
/Users/blap/AIphant/venv/lib/python3.14/site-packages/sklearn/utils/extmath.py:577: RuntimeWarning: overflow encountered in matmul
  B = Q.T @ M
/Users/blap/AIphant/venv/lib/python3.14/site-packages/sklearn/utils/extmath.py:577: RuntimeWarning: invalid value encountered in matmul
  B = Q.T @ M
/Users/blap/AIphant/venv/lib/python3.14/site-packages/sklearn/utils/extmath.py:590: RuntimeWarning: divide by zero encountered in matmul
  U = Q @ Uhat
/Users/blap/AIphant/venv/lib/python3.14/site-packages/sklearn/utils/extmath.py:590: RuntimeWarning: overflow encountered in matmul
  U = Q @ Uhat
/Users/blap/AIphant/venv/lib/python3.14/site-packages/sklearn/utils/extmath.py:590: RuntimeWarning: invalid value encountered in matmul
  U = Q @ Uhat

======================================================================
EVALUATION: Hidden Mass Inference
======================================================================

[A-JEPA v2 + Curriculum]
  Accuracy: 55.0%
  Latent separation: 0.25

[A-JEPA v2 Baseline (No Curriculum)]
  Accuracy: 52.0%
  Latent separation: 0.11

[V-JEPA v2]
  Accuracy: 53.5%
  Latent separation: 0.19

======================================================================
CURRICULUM LEARNING RESULTS
======================================================================

Model                                Params     Accuracy
------------------------------------------------------------
A-JEPA v2 + Curriculum            180,752       55.0%
A-JEPA v2 Baseline                180,752       52.0%
V-JEPA v2                       1,637,632       53.5%
------------------------------------------------------------

Curriculum Benefit: +3.0%

~ Curriculum provides marginal benefit.

🏆 A-JEPA beats V-JEPA by 1.5%!

Results saved to results/curriculum/
======================================================================
